reviewId,userName,userImage,content,score,thumbsUpCount,reviewCreatedVersion,at,replyContent,repliedAt,appVersion
4d45c4f8-c403-4b70-bc91-3908ec5266b4,chaitalee26sep,https://play-lh.googleusercontent.com/a-/ALV-UjXg9-B17KsxMUJzCAJVi4vIUVi20pOiTsxOLsWXukgekv8,no item in stock after order placed,1,0,3.166.1,2024-03-10 16:19:43,,,3.166.1
1e8e7e89-828b-4819-afe1-b62a22bc2da6,Hassan Andrew Sesay,https://play-lh.googleusercontent.com/a-/ALV-UjVmt5MV5R1zn2indR390eNGmeKbyhn7h8TEAsdjXzN_sbo,sweet food,5,0,3.166.1,2024-03-10 14:00:23,,,3.166.1
6ced5d3b-eb52-48cf-bc2c-80ad2d6f1287,nigel bowden,https://play-lh.googleusercontent.com/a/ACg8ocKqWw5Cx2qJT9NnrzOIQvZonIyofooM7L8CE182lOcs=mo,"I'm ordering food and have to pay service charge are you for real. More I spend more service charge I have to pay, are you for real. I'm paying for nothing. Uninstalling app get #######",1,0,3.159.0,2024-03-10 11:47:55,,,3.159.0
8847fdf4-09bd-42de-b075-8227cbc59a64,MW Soh,https://play-lh.googleusercontent.com/a-/ALV-UjVoD1Iz4i7pZQmUFgkmc1TTX9kpAk54WiSP498d8liGrz4,Theme keeps reverting back to green after i set it to purple. Why even have this option in the first place? The delivery notifications aren't even updating these days. I have to keep checking within the app to see where the rider is.,2,1,3.166.1,2024-03-10 11:27:36,,,3.166.1
bfb5a23f-663e-4266-b8e7-385c388acd3c,Gohar Mamoon,https://play-lh.googleusercontent.com/a/ACg8ocJX8zKN0HIN6yNBqxq_NpzJH2cX1tbjxW5tVCQcR7VRULc=mo,"They are robbers, I made deliveroo account but never order anything from them. They send a voucher code of £12 off for first order,I order through deliveroo app and add £12 voucher code,deliveroo app confirms that £12 added to my account and it showed that £12 minus from the total,but after that they debit the full amount of the order from my bank account,they not minus £12 from that order. Contract them but they refuse that I have not any voucher in my, My first and last order to deliveroo",1,0,3.166.1,2024-03-10 06:54:23,,,3.166.1
c36586bc-af89-4d6b-9442-f1393d6a3660,jacki odonnell,https://play-lh.googleusercontent.com/a/ACg8ocKmtUlqUaYJSLYr_vJRTZ2VPOlSBz7jRK9tzfuXPHhockE=mo,gets worse each time iether it's missing or they double items,1,0,3.166.1,2024-03-10 05:40:53,,,3.166.1
da718a2b-5ae0-4a3f-b05d-faf681d32f75,Pedro Santos,https://play-lh.googleusercontent.com/a-/ALV-UjXM019HbiTGsrAY6l7z6gDVg0cDB_7wdHHgKoqnQgsc,"Most efficient food service in area I live, although most of the restaurants mess up what we order either forget stuff or wrong stuff, looking at the service itself is better than competition. Keep evolving, and a opinion, give more accountability to Restaurants so they don't mess so much, I prefer to wait 10 or 20 minutes more but I get exactly what I asked.",5,8,3.166.1,2024-03-10 05:15:49,,,3.166.1
9ab1d659-437d-4d4e-8502-f171b9cb75c1,Katinmen Godrago,https://play-lh.googleusercontent.com/a-/ALV-UjV4XsSpgSSCRQX5JRITSyfgDKgWyjKcfjV1E1yhuFWIYn8,deceiving app pricing,1,0,3.166.1,2024-03-10 05:08:47,,,3.166.1
f62d6e9f-f36a-4c25-a915-d1d11939292c,paul clarke,https://play-lh.googleusercontent.com/a/ACg8ocIWOBkoQo9oB01juQqDiyCqmfdumrrcUgJ8BILBalDL=mo,brilliant. every time!!,5,0,3.166.1,2024-03-10 04:31:16,,,3.166.1
5228a814-c18f-498b-b378-3af3d4b05964,Mya Newman,https://play-lh.googleusercontent.com/a/ACg8ocK-jEgaei7D5cAwhO9fO56XNzduYadAxaFicnDANHsd=mo,My order never came. They took the money but I didn't receive any order. Absolutely ridiculous if you ask me.,3,0,3.166.1,2024-03-10 04:07:14,,,3.166.1
08700f4f-7ced-435a-9f86-7fe191ba1bb8,Cassandra Eite,https://play-lh.googleusercontent.com/a-/ALV-UjUs6LbGG-Ud8rZe5slxGgl_ltv_bDhgs1KsZprLZ6E81lE,app was very easy to use and quick!,4,0,3.166.1,2024-03-10 03:44:50,,,3.166.1
1c775f55-44f7-4770-9254-9a4958a2c4e5,Drew Crow,https://play-lh.googleusercontent.com/a/ACg8ocI9dOEnScqBC73uEqm39dRPk8oxpqFJKeZ5c1xDIcBW=mo,"I appreciate the order about the chaos. Easier to navigate and communicate than Uber and JustEat, for late-peak rushes between Riders and Patrons.",5,0,3.164.0,2024-03-10 03:32:25,,,3.164.0
a86ec274-0522-4bba-8188-a7412eefc916,Mohamed Tarek Chihi,https://play-lh.googleusercontent.com/a/ACg8ocJp4xkzqGc_y2G6d6SW4Mlwub7GqPEESc2O-zp66-kF=mo,So far so good,5,0,3.166.1,2024-03-10 03:18:06,,,3.166.1
d3cca677-4607-44b1-93d3-81a2887ad36d,Georgina Donovan,https://play-lh.googleusercontent.com/a/ACg8ocLPRgU63qPEGkiLxy51iLzXsVxFB2xuqQ6y1w5SERy3=mo,"Great service, easy app to use too",5,0,3.166.1,2024-03-10 03:13:42,,,3.166.1
5a5baecf-ade6-470f-b5bf-d6d6e2391165,A Google user,https://play-lh.googleusercontent.com/EGemoI2NTXmTsBVtJqk8jxF9rh8ApRWfsIMQSt2uE4OcpQqbFu7f7NbTK05lx80nuSijCz7sc3a277R67g,food really cold,1,0,3.166.1,2024-03-10 03:07:07,,,3.166.1
10fef517-b16c-48b7-87d7-cdb88d83198d,Vedant Patel,https://play-lh.googleusercontent.com/a/ACg8ocIFaEdsVzK0LPUSm_rdyGgTkiXhQpyjiz8KDXfj12hh=mo,They cancelled last minute even after accepting the order,1,0,3.166.1,2024-03-10 02:52:30,,,3.166.1
20bef90f-b5f1-4d58-b434-9a71e24954f1,Jale Karaturp (Psychic1jale),https://play-lh.googleusercontent.com/a-/ALV-UjWnPQDGaAeDgdMMoSrTOoSG73vhz448sk_vZ9GipuBpP1Q,Great app,5,0,3.166.1,2024-03-10 01:19:01,,,3.166.1
d4f90c9a-c2d9-4a92-82af-7fc3f17cf6be,Florin-Georgian Grigore,https://play-lh.googleusercontent.com/a-/ALV-UjWvCiWC9b2Feh-KDlrBpmiEQ5hY8GAWwzEPXRAwz2HoY_0,the scammers from deliveroo,1,0,3.165.0,2024-03-10 00:12:39,,,3.165.0
f2662bca-1820-4e73-83f0-7e2ad2c62dad,Samantha Mccann,https://play-lh.googleusercontent.com/a/ACg8ocIT0VTK3vc9_f6o6-dfI7x9DMMWV1n9FpGdVlYwgkeS=mo,Great price for my first order!! £12 off!!,5,0,3.166.1,2024-03-09 23:54:53,,,3.166.1
b87629b3-409e-465d-97fb-161a22cbce58,Tony Hinds,https://play-lh.googleusercontent.com/a/ACg8ocJvP2PBB2FftF7h6v_grVOIN6YZYzYeELUb3dWYezr9=mo,I sent flowers and the price was left on it!!??,1,0,3.166.1,2024-03-09 23:54:28,,,3.166.1
b1ef456d-df59-4c2f-bf72-7913c825abf3,Fl,https://play-lh.googleusercontent.com/a-/ALV-UjVgF3AZTUgo-DcTArZigGjGQ8yUADCyol6UFoSkH8x0Dik,"great app, quick and easy to order",5,0,3.162.0,2024-03-09 22:09:44,,,3.162.0
765fd5d3-5123-45ce-9c84-cce4cc4b6e1c,Jiayuan Qiang,https://play-lh.googleusercontent.com/a-/ALV-UjXzTMHiJkvcAHgDPfbNy3bdFG41-jyFuxdRxo-SP-QM7HA,Absolutely horrible service. Mom ordered from restaurant but there was a missing item. She had to order another time which meant another platform and delivery fee was charged. Only partial refund given after more than a week and reason was a voucher was used. Had to fight with cs to get the remaining amt back. Overall still lost money just because the service couldn't bother to check the order before collection. Better to use Grab if want food delivery. At least refund is within a day or two.,1,0,,2024-03-09 20:32:49,,,
e26f3a17-d88e-4203-9315-04f73f6438e7,Welton Souza,https://play-lh.googleusercontent.com/a-/ALV-UjXmEGsAFIdz57EslniDoPqQd7SscGJ0i38z1kIfo0AVpXNj,The application keeps offering services I don't want or need.,1,0,3.166.1,2024-03-09 20:25:17,,,3.166.1
b1913506-0a61-45e1-87af-99995413bf7d,Natali Adam,https://play-lh.googleusercontent.com/a-/ALV-UjUBXjjkAr9WT-TKpfZNdw2W0W047hgVotEfQA5uDhc2rQ,خدمة عملاء محترمين واحترافية في التعامل مع الزبائن بعكس تطبيقات توصيل طعام اخرى تماما وتم اعادة كامل المبلغ الذي تم خصمه بعد ماكنسل المطعم طلبي في الحاال,5,0,3.153.1,2024-03-09 18:52:42,,,3.153.1
ba029ad3-21d6-438f-890e-e4f18477d871,j h,https://play-lh.googleusercontent.com/a-/ALV-UjWiz8_N1oY-jhv9JaNKcPYLHi3TR9BP57RmItiQWOQvSWk,Customer service was top tier,5,0,3.166.1,2024-03-09 17:13:26,,,3.166.1
05ddd63f-93c8-4b22-a676-b9b751778aa9,Rio Gaming,https://play-lh.googleusercontent.com/a-/ALV-UjXNit8nIqtiDIYOzGXxMAbAGzJZO6rwJ8r3o12DhcP9fBg,good,5,0,3.166.1,2024-03-09 16:12:47,,,3.166.1
41fd94dd-c3c7-42de-a957-201e32c383e8,James Marshall,https://play-lh.googleusercontent.com/a/ACg8ocI2G55LY0iUxSf0UyHz6kZUOILzR2-KuIZtMJvA2ZYS=mo,"Disorganized, orders take way too long, cant find driver",1,0,3.166.1,2024-03-09 11:09:06,,,3.166.1
5021c0b2-a2e3-437d-bf1b-9b41a871e2a1,Chris. Trevor Edge,https://play-lh.googleusercontent.com/a-/ALV-UjVtOdp9tjxunYS79Cl-b0DGN4QDkMqOtuYqmZIQTdoLfA,This app USED to give you regular updates on your order. NOW you have to continually check your phone every 5 minutes to see what's going on or where your order is? The whole company is rapidly declining but I hope something can be done to remedy the problem before another company fills the gap.,3,0,3.165.0,2024-03-09 06:44:21,,,3.165.0
8dcdbb32-3a09-4d35-b5f9-10f39689aef2,Fane Gogu,https://play-lh.googleusercontent.com/a/ACg8ocIobQHFqLB9-u8-LvVKWqe_tbCY1dpZP9uek9i-vWS6=mo,"This will be my last time when I will use this food delivery service. It's the 4th time when the drivers are stealing my food, saying they are not able to deliver the food due to damage to food after 5 min on the way back to my house.",1,0,3.166.1,2024-03-09 05:37:10,,,3.166.1
b453c572-3d46-4eec-8308-2d08dbbf5840,MW,https://play-lh.googleusercontent.com/a-/ALV-UjVv030Ey4Ag4QNbAp6hCaqWAezZxQOnyXAsoCquskBULZE,Give us System Dark Mode and I'll give this App 5 Stars.,4,0,3.165.0,2024-03-09 05:17:34,,,3.165.0
f69f2ad3-a596-44a4-9211-afe77e982b3d,riri tan,https://play-lh.googleusercontent.com/a/ACg8ocLO_47ssPPzbIajsxIsfTd20QWal31CKO_CPFHN0hd2=mo,Sent wrong food and customer service are so RUDE.,1,0,3.166.1,2024-03-09 03:58:13,,,3.166.1
24655b1d-580c-4678-a646-fc8149122ca5,NightWalker.Global Chief and Dr Ricardo Coke,https://play-lh.googleusercontent.com/a-/ALV-UjV6ie3JMgx5DmNo9gTT6NHUhpYkKVkuQYIf4DvaAG3zsaM,"They sold me out of date produce pineapple then refused to refund me today ⁉️💯😞😡 😠💩💩💩 I'm seeing a solicitor about this and claiming £1,000 off them.",1,0,,2024-03-09 03:56:06,,,
76633eed-6919-4b40-ad0b-849dd41ddf13,Ettore Ferri,https://play-lh.googleusercontent.com/a-/ALV-UjV7OYkzLGaPINhWAPy7-ANyM13WR3__2Q-0yhZt0iB3lZE,"It is embarassing how bad the delivery is , for no reason at all riders that work with deliveroo are the most annoying, lamentous, unfriendly and unprofessional workers around. Receiving a delivery on time is as rare as meeting the pope in the streets. It's incredibly frustrating to wait 2 hours just to hear the rider being kinda bitchy about the fact I contacted the help center. This is just ridiculous it is way easier to just go by urself to the restaurant",1,1,3.166.1,2024-03-09 03:34:12,,,3.166.1
5436c792-b4dc-47fa-bc4a-2497aae67fc9,ibrahim sadiq,https://play-lh.googleusercontent.com/a/ACg8ocJbwxRo-YsYzqyU6VVZkzyaciIvtetRvQScnazC3X8=mo,great app,5,0,3.166.1,2024-03-09 03:19:10,,,3.166.1
eb109175-ea2d-483b-a753-2e33f3dd9647,Anthony Deaville,https://play-lh.googleusercontent.com/a/ACg8ocJqLZpUqE-lIttri5k1muRwRkfZtMu-2c8MzhW2Z06H=mo,£8 to drive down the road,1,0,3.165.0,2024-03-09 02:51:59,,,3.165.0
8ed51c8a-ce23-4c44-b2e3-0cf4beca22ae,Philip Springthorpe,https://play-lh.googleusercontent.com/a/ACg8ocLT0LjhBtFTysRm3Q5L-iObfyo62cM74jOcM1QQ_mAk=mo,"Excellent service as usual, prompt delivery and very courthouse rider. Again,highly recommend! AA++++++",5,0,3.166.1,2024-03-09 02:04:45,,,3.166.1
2fc5e079-aa71-4552-adf5-98e66cf1ceb6,Laith Alani,https://play-lh.googleusercontent.com/a/ACg8ocIyPx00Z64JHFwack-FS1VcTBR8511ZRlPkP0DQprN6=mo,poor & cheap style customer service And again...Deliveroo continues to prove bad customer service,1,1,3.166.1,2024-03-09 01:47:45,,,3.166.1
61131635-05d4-46e9-84a7-cba1219f3b09,Felix May,https://play-lh.googleusercontent.com/a-/ALV-UjWt23rBM3gfP0_9rAIK2vdsT_WC8UNIsLXDhCPZ6ra8p1_N,Android App won't let me login. Delivery's often late with no explanation. Massive fees. Waste of time. Just call your place and go pick it up,2,0,3.165.0,2024-03-09 01:00:06,,,3.165.0
5b00df5d-f7ba-4a2b-8005-70dfc0fc26fe,King King,https://play-lh.googleusercontent.com/a/ACg8ocJPyvbbRkyQfMQBQhoJ3-pGYLHZ4q3Pv5bQUKrNWXIuNw=mo,no dark mode,2,0,3.166.1,2024-03-09 00:06:55,,,3.166.1
ee94a31b-831a-4072-966a-09e6ed348936,Samson Wong,https://play-lh.googleusercontent.com/a/ACg8ocLpfyC-KnmvwoKC85-dUxC6uEF15rMNBMM0pCocpXwI=mo,Uninstall it. Full stop.,1,0,3.163.0,2024-03-08 23:56:46,,,3.163.0
7d757446-fc82-496f-b7cd-25413f06a114,Adeel Anwar,https://play-lh.googleusercontent.com/a/ACg8ocKGbRYsm79SuNpX1HMkwyq58fZAMWIvcAaTtN1shOZLqA=mo,I really want to use the bad word but won't. Such a pathetic company and worst customer service you can ever imagine. They should close the company and start begging. They deserve the worst. Simply ridiculous.,1,0,,2024-03-08 22:24:17,,,
cca84605-bc41-4ffe-9f0e-619735aa8a1f,shane bailey,https://play-lh.googleusercontent.com/a/ACg8ocKjZGrACSOn8D1Hmfe4cJFY3lJoaRjLCxYqKq-4jqt_=mo,easy.,4,0,3.166.1,2024-03-08 21:42:09,,,3.166.1
a5d7534d-e783-4596-94cf-eec73ff1bbb0,Anjan Tamang,https://play-lh.googleusercontent.com/a/ACg8ocKaTR6YgkoiKNnOhHFfdz3XzNDF5R4clWbTiPRqwk0S=mo,good,3,0,3.166.1,2024-03-08 19:48:41,,,3.166.1
39e8331d-49e1-4513-b8b8-10d0cef708dd,Love sports Man,https://play-lh.googleusercontent.com/a-/ALV-UjWdhAfBdDCyFkzKFZ40BguFw6yCwpH1UQaOmnK08UBvdQ,user friendly and convenient,5,0,3.165.0,2024-03-08 18:16:59,,,3.165.0
fee8af1c-4c8e-4e89-bb4f-02d8b30f026b,Ian Newson,https://play-lh.googleusercontent.com/a/ACg8ocK9rBX3xwiHX0W-dIMKqoA1-RS2X9Yqan-nGIXhmE4F=mo,"App is fine, service is lackluster. In 2021 I placed an order with a relatively expensive item, rider said it wasn't available and to contact customer services. I have done so many times over the past two and a half years and never gotten anywhere. Not even about the money at this point. The other services are better all around in my experience.",2,0,3.165.0,2024-03-08 11:55:42,,,3.165.0
0126f3a7-6b44-465f-b873-3b4e3f695db0,julie nichols,https://play-lh.googleusercontent.com/a/ACg8ocKQzMF6pWJA2dlAhMFSIq584XfE8TCMrEWHI0YLza5E=mo,Good,4,0,3.162.0,2024-03-08 06:48:04,,,3.162.0
0aed0226-d3ef-4ca4-89d5-7e8ff0e725b5,Jenny Sweatman,https://play-lh.googleusercontent.com/a/ACg8ocJABF98_PUg6GZfxb1ELS7eVS34nzZnuSQdre_K-uxN=mo,Absolutely excellent.,5,0,3.165.0,2024-03-08 06:32:14,,,3.165.0
eda4ef60-3a36-4c84-8da2-b14eb5103cda,Shantelligence X,https://play-lh.googleusercontent.com/a-/ALV-UjWL4Inn8_sZPNexZphPxCelje-Eo7ws0sq3s9Mh53yhsO2J,Not delivering what I ordered??? App and account deleted 😡,1,1,3.138.0,2024-03-08 05:10:57,,,3.138.0
866be5ff-64cb-49a0-974f-0118b82d947d,Louise Haselgrove,https://play-lh.googleusercontent.com/a/ACg8ocKIiBEqTvpEK3MR-4nAJzWBlYmGmzCs8Lby2LEoldKQ=mo,really lovely fresh food,5,0,3.165.0,2024-03-08 04:57:15,,,3.165.0
3e743f40-9e9f-41d8-9dd5-e8006e7c2053,Samuel (Sammie),https://play-lh.googleusercontent.com/a/ACg8ocI7pOeTmjwx0bqr97PufJCtyQX-Dc0Ww64U_2ZkczAB=mo,"timely, easy, simply good!",5,0,3.165.0,2024-03-08 04:24:09,,,3.165.0
5957f65d-79b5-4c75-a708-e4b77f0b0a96,sue fox,https://play-lh.googleusercontent.com/a-/ALV-UjW-Zf6I3PU_TQcnWJKUsAAEu53Jqv3kssGj-VRgYk3pdhU,Really fast delivery 👍,5,0,3.165.0,2024-03-08 04:09:58,,,3.165.0
915d2226-5ed5-4f5a-b85a-86c487dd065d,John Anthony,https://play-lh.googleusercontent.com/a/ACg8ocLTCkNf82T5xLs_x63GKyFU3UwtfFE-IPs3GqsC6FXX=mo,Easy to use,5,0,3.165.0,2024-03-08 03:48:08,,,3.165.0
a4855324-bbe5-4b72-8c30-e6f14ab02bd9,Rohan Bhangale,https://play-lh.googleusercontent.com/a-/ALV-UjXoN1qZMskAkcadKUjBxZIVhyMgYi_DOCJ-UtVloMVqBIkH,"Bad 👎 customer support, wrong order no compensation or fixing the issue",1,0,3.164.0,2024-03-08 02:49:23,,,3.164.0
5f44e023-4c58-4a9f-8f34-48baa29e9696,Brite Moyo,https://play-lh.googleusercontent.com/a/ACg8ocJsHlC9lL_NpWdBol8m_aVyfD8FGalU0dv-Lp28acn5=mo,Amazing drivers and delivery 🚚,5,0,3.165.0,2024-03-08 01:19:32,,,3.165.0
05af3efe-c5a6-4098-9368-0e4a56851e84,Ghans M Pandey,https://play-lh.googleusercontent.com/a-/ALV-UjUJ1DXuYr9LML6MafhGe5nfAdP5HJYCOP7fRQZvnEfqvWE,Very nice delivery platform,5,0,3.165.0,2024-03-08 01:16:56,,,3.165.0
5cc84d46-ce79-450d-a67a-c450cbe32c92,Imran Chilwan,https://play-lh.googleusercontent.com/a-/ALV-UjVbBIAq92cwXPudb658yKSyw8MYuLMBXueCjNYu2NPyHw,It didnt gave option to apply first time coupon code,1,0,3.165.0,2024-03-08 00:45:17,,,3.165.0
9573764a-1ca6-4288-bcc3-d43469e443fa,begum farhana,https://play-lh.googleusercontent.com/a-/ALV-UjXBvNwtmi01imN4bTZd2ubR7cMdgZa0BgvlEc-JjtgM60o,Rubbish,1,0,,2024-03-07 23:58:40,,,
35a3a63e-da92-433b-8c51-c445a2cf4d56,Abduljalil Mahama,https://play-lh.googleusercontent.com/a-/ALV-UjVqp8U5bL0bcnTLoULysWrL2W2yBs7KzLnD92io5rwn7A,Excellent service,5,0,3.165.0,2024-03-07 23:28:14,,,3.165.0
ec86bfca-26a9-4037-b6a7-9e69d957b5ee,mattia fumagalli,https://play-lh.googleusercontent.com/a/ACg8ocKvposeCyVt-xH3aLs_6QZIomqsvp4-u3NxtqnUJITO=mo,"Servizio pessimo. I rider arrivano a destinazione senza suonare e se ne vanno. 50€ di cibo non consegnato, vergogna",1,0,3.165.0,2024-03-07 22:59:22,,,3.165.0
ad5dba09-511b-406c-a4c7-f2976f2ee313,Allegra Azubuike,https://play-lh.googleusercontent.com/a-/ALV-UjX1v0q4qtx18R1G7pJrJ7_RPedjE91cOagLvNceW09xpYo,it's nice but I wish there were more African restaurants,4,0,3.165.0,2024-03-07 22:58:44,,,3.165.0
2b069ba3-6720-45db-9e6d-b11e79b32dac,Darkmiss,https://play-lh.googleusercontent.com/a-/ALV-UjWExJVr2XDVrDtFHf68RmZ8DsO0RONOUtdSK5EtjuBkHNk,works fine,5,0,3.165.0,2024-03-07 20:37:36,,,3.165.0
acc002d4-15fe-4863-b2b5-07245031f563,Katy Sanders,https://play-lh.googleusercontent.com/a/ACg8ocJz7MykT_2qjdh3TPdmN4iheGCmTLJ4kxauFo5mEPKQ=mo,Brilliant,5,0,3.165.0,2024-03-07 20:37:03,,,3.165.0
00407750-8ba2-4db8-9091-47390fc4126c,Janeysmurf .x.,https://play-lh.googleusercontent.com/a-/ALV-UjWNsxT2dpyVpybPLudEMl8hK9l3RLzoPFiIkgw9jQ_RG2E,Arrived in about half an hour with a very pleasant delivery driver.,5,0,3.165.0,2024-03-07 19:44:50,,,3.165.0
a69271bd-c823-41cd-b0c9-3670d0fdc4f0,celeste brown,https://play-lh.googleusercontent.com/a/ACg8ocJorsrB_CFaM9FJGZXSMtwrJQrtlV91Y6_fsREj5cLn=mo,1 item was refunded and still not given. not sure how long a refund takes.,1,0,3.165.0,2024-03-07 08:54:13,,,3.165.0
20dd7acc-0446-435b-a8c4-6d80c4b3a411,Fiona Crowe,https://play-lh.googleusercontent.com/a/ACg8ocICnOd9gW-QGA1e4U1YuMGXozP2h_QySkjrAxzz6PEkVg=mo,"Always an easy, stress free experience. Who wouldn't want that?!",5,0,3.165.0,2024-03-07 05:37:28,,,3.165.0
04d107dd-afca-4dfd-bc1e-801e500bcf17,Tenzul muñoz,https://play-lh.googleusercontent.com/a-/ALV-UjVYS-QU2XQM4-AHKO9QAQBWpJRbPTIbTMiHIUIDSgpWdFg,vouchers NOT working,1,0,3.165.0,2024-03-07 04:30:10,,,3.165.0
047a4be7-d5fa-4e98-b366-d13e66500f69,the following the first place and time,https://play-lh.googleusercontent.com/a-/ALV-UjUGb5tDzX4e6VL3ua5K4XcEMWPiMTOJ3MQYHfhFXka6yg,Excellent app straight forward to use and keeps me informed on my order process,5,0,3.165.0,2024-03-07 03:44:09,,,3.165.0
3ddeadde-ab13-47b6-9365-e8f705aec483,Josephine Agius,https://play-lh.googleusercontent.com/a/ACg8ocLaktCaqKsZeUMJZ4dWCSQEMTlCUg7CmjOr0rFvK28H=mo,Very good,4,0,3.152.2,2024-03-07 00:45:34,,,3.152.2
2a6680a0-b5cf-461f-9cd5-1cee2a79aaaf,Neha Rastogi,https://play-lh.googleusercontent.com/a/ACg8ocK94kNcS6ziIbTvAXz8h23BUSGnvoCc_sB5L4ZWgg77=mo,new account promotion was not applied,1,0,3.165.0,2024-03-06 21:10:49,,,3.165.0
b60bd050-6ad4-4924-ae93-2b02e452a15d,alsdforyou,https://play-lh.googleusercontent.com/a-/ALV-UjVIds2lRyZePCzHY8yYrcFlHOhC9fFAanCHicaHZ_JhR8Q,they tease you with £7 off which never redeems,1,0,3.165.0,2024-03-06 20:34:33,,,3.165.0
3600dfcd-ac94-4879-be1a-cdf65a58476c,Suleiman Ballout,https://play-lh.googleusercontent.com/a/ACg8ocJ6wYpTGlCxXisULCAKNQktzKKX5bhqL0R_Kqz1IROO=mo,didnt allow me to make my sandwhich 2 diff tastes,1,0,3.166.1,2024-03-06 19:04:12,,,3.166.1
47045563-1526-4bf1-96c2-ebe47dba8cf0,Carol Camp,https://play-lh.googleusercontent.com/a-/ALV-UjXF73NAzcOKnS0NSj9KjBjOYl2KzXf3EwMqmWBcppIDkSY,very good when I cannot make it out to get things.,5,0,3.165.0,2024-03-06 18:18:14,,,3.165.0
94a6c4f4-5e00-4add-ae87-b6ec0b6ce84e,AGT,https://play-lh.googleusercontent.com/a/ACg8ocKeTziZnUEQs8zfcwDc4VgAsYxZg-HU83pEUJ9qCgMa=mo,Garbage!,1,0,3.164.0,2024-03-06 17:57:53,,,3.164.0
49e7861f-3aef-4328-8532-0b6343bc3ba6,Rita Aceto,https://play-lh.googleusercontent.com/a/ACg8ocLK_VP9chDWVfbkswdl6NsLSDhMv36jP2KHDW1nt0fX=mo,takes too long to navigate,1,0,3.165.0,2024-03-06 05:29:42,,,3.165.0
5df02703-1d66-4aa4-9afb-ba798a18a730,Jodi Phillips,https://play-lh.googleusercontent.com/a/ACg8ocJ57v1WK3IK1nMKUZON0EdTATp4dTMX9akdQsiTqLTK=mo,Absolutely beautiful food ...everything was fantastic thank you,5,0,3.165.0,2024-03-06 04:52:07,,,3.165.0
004dee32-94d0-4937-aad5-70da89454cfe,Gul Majeed,https://play-lh.googleusercontent.com/a/ACg8ocK6fVa5-C-OiN2iLrkLFZ6tyjMKklJ-jnAKl70i-TPqTjU=mo,excellent quick delivery perfect time,5,0,3.165.0,2024-03-06 04:07:27,,,3.165.0
3a81ea6f-b557-47f7-8d68-be6693e8a6f4,Tracey Anthony,https://play-lh.googleusercontent.com/a-/ALV-UjWsoRqBu0JQntxXnak9BOGoZ5jrpG3WglQqUqvODrJlZg,"nothing but good things to say, drivers are always polite and friendly 😊 👌",5,0,3.164.0,2024-03-06 03:47:42,,,3.164.0
b1262e92-e4e0-45eb-a8d4-d9b0b2dd9cd8,Ed Peck,https://play-lh.googleusercontent.com/a-/ALV-UjU7EOtbtOhP_dP8w4iHd07JnNqsZh5Ht-REmNmJ5GEv7gY,"they offered me a voucher code, then didn't let me use it. Scam.",1,0,3.165.0,2024-03-06 03:01:21,,,3.165.0
1449f2ca-ea9a-4507-b38b-140160a30021,Sharon Shachar,https://play-lh.googleusercontent.com/a-/ALV-UjU0mBWhN4X6H-9e4ICbECWDWarp65_zhf8PG5w_wqI0_QQ,"Very helpful, resolved a situation over live chat very efficiently",5,0,3.165.0,2024-03-06 02:50:06,,,3.165.0
a34d2d05-dd03-4e38-b4e5-273a7d6e8b96,Adelaide Patriciello,https://play-lh.googleusercontent.com/a-/ALV-UjXtv_KVP0W6bfZPec68mPiuih0LmWP2p7kp0IPUqtEhZd4,Excellent app if one is hungry,5,0,3.164.0,2024-03-06 02:44:04,,,3.164.0
5917f682-1917-448d-85ee-e640a2f273d6,Daniel Gaureanu,https://play-lh.googleusercontent.com/a/ACg8ocKqWFIdC81aOhhjtUwGIJFsgMBekuhj3yeX7PRheeTU=mo,so far so good,5,0,3.165.0,2024-03-06 02:29:12,,,3.165.0
1ced0861-352c-476f-a404-65fc72a06233,Ashley Haynes,https://play-lh.googleusercontent.com/a-/ALV-UjUHCIjKrKdG7P-vL5SZliPGIB-_m_uKaIpxXsFxJqrKzpE,to many fees an not another pay to riders,3,0,3.165.0,2024-03-06 02:28:51,,,3.165.0
7de2dd55-526a-4269-88d2-14fa49e16656,Emma Mumford,https://play-lh.googleusercontent.com/a-/ALV-UjUZ34ASbhou1wJNolvBaoHR06dodY2sGVTMwz2WFLG_W8w,"Cold food, app is good",2,0,3.164.0,2024-03-06 02:22:32,,,3.164.0
be08bde8-4367-4516-a70a-7fde0bbb929d,Russ MacMillan,https://play-lh.googleusercontent.com/a/ACg8ocLb2lu-4ybYFW6mwqF0HdZhdNgIiAQZT4CrkdAMAq3n=mo,v expensive,3,0,3.162.0,2024-03-06 01:55:37,,,3.162.0
b4603f92-1b39-4f6c-984f-6e7f441fc0f7,Steve Collins,https://play-lh.googleusercontent.com/a/ACg8ocIYvyaMYVhugtoVaKEX9rEe00_4DmsPS18NscW_QHRX=mo,"First time user, so easy to set up and order. Would recommend this app. Great selection of fine food outlets.",5,0,3.165.0,2024-03-06 00:44:26,,,3.165.0
ef4105d3-dcce-45ad-81a4-54f4afdea09f,Francis Ferdinand Castillo,https://play-lh.googleusercontent.com/a-/ALV-UjVlzFEGhLbgjP1tOVTrRZ1BychM7FtdRN6k2QDMMoMXow,My primary delivery app!,5,0,3.165.0,2024-03-05 22:24:59,,,3.165.0
2d0a54c9-edc2-4288-b559-a361b08ef19a,Dylan Lloyd,https://play-lh.googleusercontent.com/a/ACg8ocK55Y_QzLNRQevQGF3k3R-jDjrq5kBZdn8uPofBRXDjtw=mo,"If you want a quick and easy meal, don't go for deliveroo. They take an hour at the minimum to deliver food that should take 20 mins. Its a shame, really. They use to be decent in my area but should be ashamed at how long it takes to deliver.",1,0,3.165.0,2024-03-05 21:35:08,,,3.165.0
4aeb2549-1df6-4783-83cc-04bdcd144b64,Wina Navratilova,https://play-lh.googleusercontent.com/a/ACg8ocJcq85BiZDIYuDzOyg5p63S0UkmIG_Xg_wVz0UNzjGe=mo,nice app,5,0,3.165.0,2024-03-05 21:06:17,,,3.165.0
e7918156-db7a-4b06-9194-24dbf26832fc,Mohammad Qunbos,https://play-lh.googleusercontent.com/a-/ALV-UjXkWYcRMjaINIhqRGyaN7nH47L3kvAN_uJIZyHzVvcpOE_G,Wrong items delivered with no way available to communicate. This is a scam,1,0,3.166.0,2024-03-05 19:17:28,,,3.166.0
bb5c85c0-e72a-4916-83cf-a89057076587,Kaboom sihal,https://play-lh.googleusercontent.com/a/ACg8ocL_0vOtgXPBnW8Z77pifDm-Z-w5aAHxXKji4QV0hkLn=mo,"Horrible service, incredibly rude and unprofessional drivers, you can be happy if you get about half of what you ordered",1,0,3.159.0,2024-03-05 18:55:00,,,3.159.0
39770436-8135-456e-8543-4c5b69626b50,Emma Bate (Ems),https://play-lh.googleusercontent.com/a/ACg8ocLIyoMxFGhMCcL_r9Bmm7dmIxiyMHlfFPIkeV_xqL7py6I=mo,Good app.,4,0,3.164.0,2024-03-05 15:24:11,,,3.164.0
d187c96b-1f76-4eee-9e72-f589c6970ee8,Kelly Stewart,https://play-lh.googleusercontent.com/a-/ALV-UjX7FHzIhtaG3joMJMUg-WfmcbiPqKfrlbgCJwaVE_IB3oVl,quite slow and clunky,4,0,3.165.0,2024-03-05 08:09:38,,,3.165.0
afe9e06d-9d46-4871-bd13-d1605d2f2252,Banele Prince,https://play-lh.googleusercontent.com/a-/ALV-UjUXKm2OdcGP1WEwDmCzn11OGgK6MOhla6XAU_wZ5bhpAQ,The best food app I have had you can also buy electronict so good,5,0,3.164.0,2024-03-05 05:13:18,,,3.164.0
a5e7c760-7747-42da-a5af-f1998ded0627,Akshay Khanolkar,https://play-lh.googleusercontent.com/a/ACg8ocLOclD42MDv7wgKAbDcW76OKDaOMERJ7yoqCRg0bpNL=mo,"Great service, however, your delivery depends a lot on the restaurants packing your food. Wish there was a way to regulate this",4,0,3.164.0,2024-03-05 05:07:39,,,3.164.0
808fc9fc-5b37-4512-8e18-f4260172f3fc,john barker,https://play-lh.googleusercontent.com/a/ACg8ocIC4jmpAszF4FTxGqBBOyX0C8xJPlzuz4LTsc7gJ5uN=mo,💩,1,0,3.164.0,2024-03-05 04:12:18,,,3.164.0
f5cfc497-477d-47ea-822f-4f8d86c670d7,Sydney Sithole,https://play-lh.googleusercontent.com/a-/ALV-UjWynZrgzxiA093_IZfqDDXGf_LIfz_Whcue32J7D7eu6uc,Could have easily given 5 stars but I got a wrong order the other day and was not satisfied with how it was handled. Apart from that you offer good services though,4,0,3.165.0,2024-03-05 03:14:39,,,3.165.0
