reviewId,userName,userImage,content,score,thumbsUpCount,reviewCreatedVersion,at,replyContent,repliedAt,appVersion
31d518b3-a905-4128-ba5a-61f4750a4e7a,Troy Chan,https://play-lh.googleusercontent.com/a/ACg8ocIfuk5mTi05yrIR-mXpXpyz2VuhQFurdTwPsB8yRTrN=mo,"Cancel,Cancel,Cancel Then I also cancel the app",1,0,24.3.0,2024-03-20 12:53:36,,,24.3.0
c494f347-af38-406b-9459-4e03f40430aa,jovelyn castaños,https://play-lh.googleusercontent.com/a-/ALV-UjUd2610MrFWwd4urWY8NqeW-3ckT56E5SN7NQdDCq8uTA,the one who save when i have nothing to eat,5,0,24.3.0,2024-03-20 12:46:25,,,24.3.0
d8c69ebc-40ff-4825-a735-602c11dc831b,Tasin Habib,https://play-lh.googleusercontent.com/a/ACg8ocLn10Kg1z3MpG3-obTbpebEZg9riF4Aa0pkddBEL4Pg=mo,It Never disappoint me,4,0,,2024-03-20 12:29:45,,,
3bf01bbe-65c5-4f85-82e1-7f9520f63ebe,Charlie Borbajo,https://play-lh.googleusercontent.com/a/ACg8ocI3SiE8ZOHLAryPs7f2S8YVOIw8xv2F0srlGtAh5r1xeg=mo,"The app and it's creator is super duper dumb!!! I cannot place an order because it keeps on saying my number is already in use! So what! I just need to receive my ORDER!!! No matter where I am so long as I put my number in, it should accept my order without any HASSLE!!!",1,0,24.4.1,2024-03-20 11:12:21,,,24.4.1
f5cae38c-9a26-46a1-8b97-3c0529bf5d4b,Josh Cubing,https://play-lh.googleusercontent.com/a-/ALV-UjWvuOkDolYFQ5nrR1I1FQJ4Wyp7WrDC-OLYhWOamof_aT7f,Bad customer service. Slow refund for an inconvenience they caused. Took out money from my online bank but did not put my order through.,1,0,24.3.0,2024-03-20 11:10:20,,,24.3.0
b1ec3741-e761-4fd4-b2b8-8460b4eab33e,M nawaz M nawaz,https://play-lh.googleusercontent.com/a/ACg8ocKpYg_HcFIK0-s2HYq7J56VlQH98YJ10ehL8msf1XwZ=mo,Bay karr app,1,0,24.4.1,2024-03-20 11:05:29,,,24.4.1
6fff699e-18db-4c75-a8fa-0c5e5855090d,Md Kabir,https://play-lh.googleusercontent.com/a/ACg8ocJA2rZTjM4pCsMcl6aAeqYd4nEF11ulQkdJ4yNVg9H5=mo,োো,5,0,,2024-03-20 10:50:52,,,
50bbd91b-13df-4d0c-ba61-db092559918d,Patszxc,https://play-lh.googleusercontent.com/a-/ALV-UjV1JHV6cvskYTmXJyQ2H820c6fjFAdzxape_tsCCABSbw,"MY MONEY WAS TAKEN BUT THE ORDER WAS CANCELLED, NOT SHOWING UP IN HISTORY FOR A REFUND, SCAMMERS",1,0,24.3.0,2024-03-20 10:32:18,,,24.3.0
d5a38c76-bc05-4b29-ae59-a275c5aa7393,Dark Veer,https://play-lh.googleusercontent.com/a-/ALV-UjXyHl4e9_YhZSLDgIkLwRC8kFW6XSlDGETdXJqfC6bhECU,"simply nice but some restaurant are not listed and everytime they ask location it's very irritating, if go another location then ask no problem but when i open the app location service are open 😔",4,0,24.3.0,2024-03-20 10:16:50,,,24.3.0
b418a0fe-974b-4fa0-b6fe-2906cbd3ad19,WASHI JUTT,https://play-lh.googleusercontent.com/a-/ALV-UjWD24oY8pLPLFZBModO1cafgTStvtNlsYcM4PDTxPKvlQY,Good fundtion,5,0,24.2.0,2024-03-20 10:06:16,,,24.2.0
937a584e-f5bb-4e8a-858f-b47e43e0b69b,Maaz Ahmed gaming,https://play-lh.googleusercontent.com/a-/ALV-UjWItuhreSoHOMYkJqUsUy_wzafprIBHDwuo0qBGm4987g,"Nice , but experience is not the best when it comes to refund",4,0,,2024-03-20 09:30:38,,,
99015935-1077-4a6f-ae30-be9732b515b8,Tito Ian Reyes,https://play-lh.googleusercontent.com/a-/ALV-UjXxxDJBAUTo5C9mBHOtyIwNB9PZZQbhl5RVgevgBYNFFw,"tuso tong app nato at epal lagi sa gaming app, akala nyo iinstall ko yan? - 0 star ka sakin,",1,0,,2024-03-20 08:33:10,,,
9d747ae9-b539-4f44-b8a5-9fc058694a70,John Smith,https://play-lh.googleusercontent.com/a-/ALV-UjUaj1Vj-0UOeRhuy12clJ5aNLPS7zLDXP0ghoKEuIptPC0,"Not reliable in terms of refund due to their faulty system. I was charged 1500 pesos in my 2 orders but still refund was not yet received. Undelivered order is appearing/paid status in recent activity tab but not visible in past orders tab where you can request refund. Help center is like robots, sending generic response. Telling you to wait but still the refund and my money was yet sent back to my e-wallet. Never again to this app. Happened last March 18, 2024. Affected multiple users in the PH",1,0,21.16.1,2024-03-20 07:36:27,,,21.16.1
131f2efd-2ff3-4e98-af30-f75af5ffc699,Mixo Senpai,https://play-lh.googleusercontent.com/a-/ALV-UjX3SyhmbwAFxtEx_NBMTfCUuU_hYod8W58SJDU5937T4ME,"Disturbing everywhere . It's a Ramadan month. If you want to advertise in YouTube,just don't add beat with it and smooth something else",1,0,24.3.0,2024-03-20 07:24:26,,,24.3.0
195d2511-2fcf-4255-9bda-e9e1c57ef8ba,Md. Zahirul Islam (Zahir Talukder),https://play-lh.googleusercontent.com/a-/ALV-UjUiIWS3-LMQZROpF_ThLCVj26mDubVsFaj23Vfo4j4yXQ,Good service,5,0,24.4.1,2024-03-20 07:15:12,,,24.4.1
1e7c1cc9-3792-4aed-9278-5026cf448aa0,Ahiyan Ridoy,https://play-lh.googleusercontent.com/a/ACg8ocKDk1u4vZ11SwJuYhQCVfjTea1F4N08VUGn2numz0-C=mo,Worst App for Food Delivery 🙂 Eder jonno ajk roja ta thakte pari order korci 3:49 a ar delivery kono kobor e cilo na 🙂 Canecl korle o buje partam but eita ki vai 🙂 pani kheye roja ta rakhlam thanks 🙏,1,0,24.2.0,2024-03-20 06:47:42,,,24.2.0
50526fcf-64a2-49e8-afbc-1fea8a9445f7,Jewel Rana,https://play-lh.googleusercontent.com/a-/ALV-UjXbGUzLeXyQi4yE-aWbZhq0__fJn7ulJxJezfPHb6w1Rxxh,এই এ্যড টা আমার কাছে খুবই বিরক্তিকর লাগে। দয়া করে এ্যড না আসলে খুশি হতাম।,5,0,23.10.1,2024-03-20 06:46:11,,,23.10.1
7e5148c8-521a-4a75-9abe-d73dc32b2b58,Aadam Ibne,https://play-lh.googleusercontent.com/a/ACg8ocKysJr-BzI_7ZZRz5s9uM-y7MjugXt-ushKqozGInRG=mo,So much excellent platform,5,0,24.3.0,2024-03-20 06:14:39,,,24.3.0
bf4e8df2-5541-4de1-9e1e-4e4eabbd3f03,Bryan Arabiana,https://play-lh.googleusercontent.com/a-/ALV-UjX489udzy3bgyJlMfXbnXTlTjIcZMet3DKIZQq1biwBL8w,"Stup*d support people! Your app and support center are ALL USELESS piece of junk. We're asking for a refund due to YOUR system issue getting debited and not getting our order confirmation, yet your useless support agents are asking for an order code??? How can we give you an order code if it was not processed??? How can we give you an order code when there is no order code given when we processed the payment??? We're NOT new to your app. The payment went through but the order was not processed!",1,0,24.4.1,2024-03-20 05:48:16,,,24.4.1
d7cfc1b7-74d8-4282-aba0-702892d3e005,JM,https://play-lh.googleusercontent.com/a/ACg8ocJieCI0iTEJcyB9EqNTvho766oGKjOTLRC0UFJEeUhT=mo,Great app. Spoiling people with comfort. Providing great job opportunities. It's been a great help to me personally. Thank you.,5,0,24.4.1,2024-03-20 04:36:34,,,24.4.1
0b42bee3-4646-48d5-8a6c-e8cc69e8a381,Abdul Ghaffar Khan,https://play-lh.googleusercontent.com/a-/ALV-UjUZGyA1RZDxF5NFeDPNzhFrcTQyRzFCZA1QzQYjzT_d8ac,"Very nice deals, fast delivery.",5,0,24.4.1,2024-03-20 04:26:12,,,24.4.1
95d7d635-ea3e-445e-800a-941436ed7904,Asif Khan,https://play-lh.googleusercontent.com/a-/ALV-UjVlfKZWfg0QVZU0nY8ZhVshEccVWDuKoIjP_ODVJVK9smU,Panda on top best service and fast love it,5,0,,2024-03-20 03:50:48,,,
d7ebd58e-159c-4845-b160-765c60ebe3b0,Aisha Rafi,https://play-lh.googleusercontent.com/a/ACg8ocIHrlKOvaTikfw_yaIw9E3XlHMW-5A2HyuAGMQJ8Jd-=mo,zbrdsdt services,4,0,24.4.1,2024-03-20 02:34:38,,,24.4.1
584c55f3-c580-4608-b8bd-b8a70088be3a,Tanvir Mohal Distt. President PPP Jhang,https://play-lh.googleusercontent.com/a-/ALV-UjVaFoH94VJ5qniMnvwEcCUMa2a9XSQ75YR3lgkfnt2b2g0,Worst app cancel order itself or many time it says sorry we aren't available in ur area I would prefer using other apps than this and most of the time is meal time and is always open they need to fix it👎,1,0,24.3.0,2024-03-20 02:29:38,,,24.3.0
05893234-2342-4845-98a0-674e4e0a15b7,Ali Imran,https://play-lh.googleusercontent.com/a/ACg8ocK3Xe47KElYLu_dAKnvVSBsJG0Qy42-T13ploWERG1z=mo,"Dishonesty,at its peek.Why do you send items cash on delivery once or twice after charging monthly plan.Do you have any reason?Just irritating and shameful atttude.",1,0,23.23.0,2024-03-20 02:21:29,,,23.23.0
fdca2420-9479-4f4e-b6c6-c544cfe82c1f,Umaima Iqbal,https://play-lh.googleusercontent.com/a/ACg8ocLX018Q4GFCvO8BP-v650V7mIyfsoHezB6XAu9YTZN5=mo,Bht Zabardast hai Delivery boy ki service bht achii hai,5,0,23.20.0,2024-03-20 02:16:35,,,23.20.0
88753aa8-4afc-4a57-9dfd-1b77c003e285,Randy Tampos,https://play-lh.googleusercontent.com/a-/ALV-UjUbW8OgSBQT_pLqTcEhCDwqFhPjTZaRBfXx3AW-1-a0eA,More improve the can interrupt,2,0,,2024-03-20 01:12:11,,,
dc7bd349-95f7-4188-84b4-4410936ee52e,Dennis Francisco,https://play-lh.googleusercontent.com/a-/ALV-UjVvF-bxqR3gAe7ICrEwnF-BqgwsaidqazFIkWznq-8Kog,Mga scammer at mga manloloko karamihan dito mapa customer vendor or rider mga manloloko dahil yan sa bulok na system ni food panda anlayo sa system ni grab maayos sa grab,1,0,24.3.0,2024-03-20 01:09:03,,,24.3.0
eae166ce-a42c-4c06-86e8-7cddf9bdaae8,Ghulam Zainab,https://play-lh.googleusercontent.com/a/ACg8ocLPWJ_VSrJ-5Q78AvJ94FyTKx6sbeMqIiRwbJO6ZwrS=mo,Delivery charges are too high now. Itny ki cheez nahi Hoti jitny d.c AA jata h,1,0,24.3.0,2024-03-20 01:03:28,,,24.3.0
8ddaa2b2-771c-4354-996b-f17e05d1eee1,Annalyn Perez,https://play-lh.googleusercontent.com/a-/ALV-UjXJkQmMwcgcsgzl5dG2bO4sdeYed0-0m9f-jaBmU0QNFd0,Magamda,5,0,,2024-03-20 00:01:39,,,
16cb9bb7-aac0-4e8b-802f-77ba137c6b36,Ammar Ikhwan OLAHRAGA,https://play-lh.googleusercontent.com/a-/ALV-UjUaZf8dfpHxXJwVFwX9yDlACoDVpnGuK37y_K2ifl2o0JvM,"there are always the same problem, i didnt get my food and i cant cancel the order. i lost money and food 2 times and for me it is such a huge failure",1,0,24.3.0,2024-03-19 23:38:10,,,24.3.0
2fb64dc5-bc6f-40be-a46f-37655fdaf8b5,Hussam Mufti,https://play-lh.googleusercontent.com/a-/ALV-UjU1bMjmQa5B7kQhYVTElOsgmvyOzDp-xUdC41hXspMhMS20,"A bunch of thieves. The rider picked up my order and then stated that I canceled it when I never did such a thing. When I contacted their support team they would not give me a refund saying that I was the one to cancel the order. How can an app give it's riders powers to so easily steal an order?! Stay away from this app. Have deleted the app, will never use them again.",1,0,24.4.1,2024-03-19 23:26:41,,,24.4.1
b584fce9-1140-4d63-96e7-dafca8869811,Nesli Ann Olea,https://play-lh.googleusercontent.com/a-/ALV-UjUJOX0UdKwpfFLnA0wpM1L8SgJqeJ7d5vj65qtXzXL3vQ,"I've been charged 2 and didn't receive my order, and until now i didn't receive my refund. I hope you take action on this because i didn't work for this app to scam me.",1,0,23.14.0,2024-03-19 23:24:43,,,23.14.0
6a606376-8314-4b8b-8cae-847e7be496d8,Tahreem Fatima,https://play-lh.googleusercontent.com/a/ACg8ocLqeTSQSo-0g0HCLR2FmzSywVLdVfup9C_qw5HqTFaz=mo,Convenient.,4,0,24.4.1,2024-03-19 23:21:54,,,24.4.1
55baeee6-e33d-4f28-870f-6995f31a6694,Adnan Riaz,https://play-lh.googleusercontent.com/a-/ALV-UjW5mgdHO0JnYMtu3q2v4ITbFLCg52vympryI8EZI4ipvw,Getting worse every passing day. No remedy for delayed orders.,1,0,24.4.1,2024-03-19 23:20:21,,,24.4.1
e2157e3f-97d4-4a70-839f-28306d93d570,Alec Jan Bayotlang,https://play-lh.googleusercontent.com/a-/ALV-UjWU4w7XRIOLKytCqMsKOlXgxzizVsrKBCwvoCURID7IShU,kumpara mo sa ngyab puro walang rider na pumipikup 💕,5,0,24.4.1,2024-03-19 22:58:09,,,24.4.1
2aa4399f-2431-4efe-aa63-89614b77929a,GL GHOST,https://play-lh.googleusercontent.com/a-/ALV-UjX37WIZlDhz_wFdyr3NWZtGLk4NDjTFh21BTHGgGkFhGKk,Not recommend,1,0,24.3.0,2024-03-19 22:26:07,,,24.3.0
cb6ddcd4-c5c4-4525-aef3-ed39d920d711,Salihah Qureshi,https://play-lh.googleusercontent.com/a/ACg8ocLmF2-h36B9biXhOM9Lh-gcyWVHhG-mduPo2FljKokA=mo,Yummy food and easy useful app in Pakistan all things are available to buy groceries bakery etc...,4,0,24.4.1,2024-03-19 22:07:34,,,24.4.1
afe34acf-11c7-481b-847b-9e8baee8b8ad,Aj DEOCADEZ,https://play-lh.googleusercontent.com/a-/ALV-UjWd043xv_SsKvLBNQckzGD12yiEHoddYn3iKiw5asPC3A,Pakibilisan ng refund langya antagal kayu na naka abala antagal pa mag refund g cash payment succes sabay error occur nawala yung order anu na food panda antagal refund,1,0,24.3.0,2024-03-19 21:43:43,,,24.3.0
d4821435-d7ca-4c97-a0ad-c3f5a12ef033,Juvy Ombao,https://play-lh.googleusercontent.com/a-/ALV-UjXkm0oHLvwTxm9I8v11La-D0MGP5-2_1RTPZhLPIV8msw,I'm ok thanks you,5,0,24.4.1,2024-03-19 21:20:58,,,24.4.1
02ef825d-4f8b-4ee4-9f9b-beaf0a05d456,Siam Ahmed,https://play-lh.googleusercontent.com/a/ACg8ocJY4MxbhssEvLwGjVxWBDQXihYT13N2PSwKDTtaUiZO=mo,In 2021 this app was awesome and great but now this app🥴,3,0,21.16.1,2024-03-19 20:53:18,,,21.16.1
a2dd493e-1129-4a3f-8a9a-c3ad86d92250,Warda Jamil,https://play-lh.googleusercontent.com/a-/ALV-UjWurAdqO813QbtwpsMQTHNaaVYRy4UHkQi6pWTAYldzU2kh,pandamart buht hi bura hai inka... waha se ziyadatar chezain khrb use hui v or expired ati hai..,1,0,24.2.0,2024-03-19 20:39:21,,,24.2.0
05881cd7-6e23-4c10-8f9e-14903af205af,Fakhrul Hariz,https://play-lh.googleusercontent.com/a-/ALV-UjXB7xlegElS_D7h6wRNNYr0NFJYvXIOkdLeSrxTlr1mHf8,"My orders got cancelled thrice lol. I can't even make my sahoor. Not to be such a cruel citizen, I did ordered it early.",1,0,,2024-03-19 20:39:01,,,
add60ebc-de42-44bf-8278-82140802c83e,Syeda Shiza Jamil,https://play-lh.googleusercontent.com/a-/ALV-UjV2KNmB3ZJsuA8eWqu-y8c6qXt6oxtb9BZBgnSrbY_rGkSn,"Please don't buy anything from pandamart.. they sent damage, expired & use items... Very bad service",1,0,24.4.1,2024-03-19 20:37:49,,,24.4.1
0317bb9d-b500-4ba4-b5a8-876bfefd526c,JN JN,https://play-lh.googleusercontent.com/a/ACg8ocKwn1_dRCMtHvIbwKMUnKHvrrE5r0e6L7nsOs6v4vbn=mo,the best,5,0,24.3.0,2024-03-19 20:18:54,,,24.3.0
e4b4fe17-dc5d-43da-8c87-71d32d10dc23,Hafiz Mohammed,https://play-lh.googleusercontent.com/a-/ALV-UjWlbcdujrJepaN2rHAEW4JOzIa8gl5fRihWU-jbemqOnXo,এখন প্রজন্ত বেশ ভালোই লাগছে কোন ধরনের অসুবিধা দেখছি না।,4,0,24.4.1,2024-03-19 20:01:17,,,24.4.1
98c2f004-7aef-4b43-8967-8bfaf9e4558c,Ahmad Waqar,https://play-lh.googleusercontent.com/a/ACg8ocI3Lxmy2E7bVnZ-FNqew_f8_tZNg44MAKSHdGVKhJvykA=mo,"Thieves, online payments are done and all from bank sides and then these guys lie that the bank did not make proper payments Alot of the time they show items that are not there and then put money in wallet, when you try to put it back into your bank they show notification that money was transferred but after confirmation with bank no such thing was done",1,0,24.3.0,2024-03-19 19:48:31,,,24.3.0
fb464b29-6b4b-4cac-af0e-0c46d6353598,Apple id,https://play-lh.googleusercontent.com/a/ACg8ocLb4xpjl--42Yao3uUBpdixxPnbOYQQ8Hds3WXNIS3U=mo,good service,5,0,24.3.0,2024-03-19 19:46:22,,,24.3.0
c5754e29-4a68-4cac-9bf2-0eb523729241,Ali Saha,https://play-lh.googleusercontent.com/a/ACg8ocJEVd-vpITfZJfH22dSZN6NXzU8PmuysZE4xyTJIXvW=mo,Such a bakwas app ye cheat karty Hain paisy zada lety Hain very bad,1,0,24.3.0,2024-03-19 19:39:28,,,24.3.0
47f47c36-8881-4a9c-9878-a8b7f38f22d2,Emily Elvira Gido,https://play-lh.googleusercontent.com/a/ACg8ocLFyBMJ8RfLkIx1D-KryNLfwgQqYnXbyzdcLzSZsKQH=mo,dependable at all times,5,0,24.3.0,2024-03-19 19:18:36,,,24.3.0
efc1aa91-6d7f-4465-ae82-97da48f35413,syed shaheer ali,https://play-lh.googleusercontent.com/a-/ALV-UjUYRebVCgbNenxt86ZWNWIEDTJCe1iJKy7niYeR-ztQLpk,❌❌❌❌❌❌❌❌❌❌❌❌❌❌❌❌,4,0,,2024-03-19 19:16:56,,,
0e404ab5-74e8-4673-a4b5-c4b0a77d398d,Danica Juelle,https://play-lh.googleusercontent.com/a-/ALV-UjUUtx1qIEF1TevnUuYl7_il1MkJhXllM-CqGzn68uKapg,U CAN PAY EVEN IF UR NOT VERIFIED♡♡♡♡♡♡♡♡♡♡,5,0,24.4.1,2024-03-19 19:13:16,,,24.4.1
1e222233-6881-45d5-8457-237bef5a598c,The Unique Uploader,https://play-lh.googleusercontent.com/a-/ALV-UjXXUnFADUDApjWtlXVPb-bOgKeuCVlMtTXhvLuhexgLQNU,good service,5,0,24.3.0,2024-03-19 19:05:17,,,24.3.0
623f6927-9828-4ec4-befd-bef4c13a206f,Sarah Rajpoot,https://play-lh.googleusercontent.com/a/ACg8ocKROFboqfgK52Ju6dIEpgSH6CaBGwVMNZNfAwB56KEx=mo,Lol application totally money waste and time wast,1,0,24.3.0,2024-03-19 18:44:00,,,24.3.0
d3901893-3216-4b70-bfd4-e80a6b2d95d6,Usama Mughal,https://play-lh.googleusercontent.com/a-/ALV-UjX_inkVrmA0W8Ko96yuC4_pCPSF80batFKxkYQfKpDBVv8,How can someone buy something without seeing? Pandamart need to fix. Images are not loading at all,4,0,24.3.0,2024-03-19 18:38:03,,,24.3.0
28db33c1-d2b3-4917-abff-636cf5cba5a8,Ed Leonisa,https://play-lh.googleusercontent.com/a-/ALV-UjUHrtb_bm1rMP1hyy_q355x7PkPitNQMDzU6qfebyR6tUQ,Scammer.,1,0,24.3.0,2024-03-19 18:31:11,,,24.3.0
43913b78-8487-4f9f-b2cc-3a5763c4dcfa,"Manlangit, Paula Bianca C.",https://play-lh.googleusercontent.com/a-/ALV-UjUthDd0FoW6qizdH63wnCBYgHv0CGlDsaxQ-V6DTfdiPXc,"Been using this app for a long time now and before, vouchers are really good especially during petsa de peligro. But right now, vouchers are not working most of the time and the only times they do, the minimum amount of it is too high for a one-person order. The vouchers that are advertised in every restos can't even be used anymore (idk why they still put it up if a person can't use it).",2,18,24.3.0,2024-03-19 18:30:22,,,24.3.0
587af4a9-4105-4a7d-9dbb-dd730b2eddc1,Solomon Joyce Amancio,https://play-lh.googleusercontent.com/a-/ALV-UjWm5zZl780CP39QBSjLMp8K3uUgourJQmc_dpira2d9Mw,I ordered at shell shop yesterday around 2-3pm however the ordered dissapeared. I never received the order and I have been charged. Its not reflecting in order history but it shows my card has beed deducted for the total amount. Your customer service replied automated messages and its been 24 hours now. I want my money back and you guys should provide compensation. I will make sure that all my friends and family even social media will be aware of this negligence.,1,0,23.13.1,2024-03-19 18:23:46,,,23.13.1
b3324d85-a997-424b-86d8-1ed656a0df25,Queence Romero,https://play-lh.googleusercontent.com/a-/ALV-UjV89LwgN85qsUbIV7PIXDHqbGxl8dqdd8SAJfokjBN7ug,Money not refunded. Na cancel nang store yung order ko. Pero hindi nila binalik yung gcsh payment ko. Bwisit kayo?? Walang nag rereply sa app nila!!!,1,0,24.3.0,2024-03-19 18:16:08,,,24.3.0
a8e088b3-e9c2-4af7-ba62-be2aae56c45d,SITI SARAHH,https://play-lh.googleusercontent.com/a-/ALV-UjUpyK8dXm3qDan2D-BluyKwL6538TPXt_8ZUioZAQhCWwc,Best,5,0,24.3.0,2024-03-19 18:03:43,,,24.3.0
c77f4a19-696c-40fd-9510-2037c60f3365,Kim Sokheng,https://play-lh.googleusercontent.com/a-/ALV-UjUFZn2hFbyc9HACGiQC0nTbClB0StAsMY3OXfQ2eRXFb1M,good,5,0,24.3.0,2024-03-19 17:50:57,,,24.3.0
bfca518c-f697-47b5-8667-d71c580f16c5,Syah Rezall,https://play-lh.googleusercontent.com/a-/ALV-UjVrP2gWd0CxQdVBH8mInorm0fXpDENdjdTdt0jnwtGJAOk,lol mahal lepas tu suda set location bole pin tmpat lain!!!!!!!,1,0,24.3.0,2024-03-19 17:49:49,,,24.3.0
9ae29869-ce09-43b9-a3e5-56fe374b71ab,Issei Batallion,https://play-lh.googleusercontent.com/a/ACg8ocIk9IQ75d9rx-9Ef91QxUSFySuhcBypgUWtcSbZVthOkA=mo,"UNRESPONSIVE CUSTOMER SERVICE. I have recently encountered an unfortunate problem with foodpanda, I placed an order yesterday in which I paid using online payment. The charge was made (I was charged ₱201.00) but the order was never registered and non-existent, their customer service refuses to answer my concerns and emails.",1,0,5.12.0,2024-03-19 17:47:44,,,5.12.0
c96fe672-01ce-4cb6-9089-e2e282809356,Sierra Loyard,https://play-lh.googleusercontent.com/a-/ALV-UjUzaN1rf3igscB4y9NdVSeV2FrbGDuZGFlZqQXlMRtExQ,"App had an issue yesterday. I place an order and was deducted from my bank but I didn't receive my order nor I receive any email abt it. it totally disappeared w/out a trace.. it disappeared from my order hstory although I saw it before dsappearing and it says 15-25 mins delivery time then it was updated to 10-20 mins. Right after that, it totoally disappeared. I AM UNDESCRIBABLY disappointed. I need to get at least refunded. 600 PHP ISNT A SMALL AMT.",1,0,24.3.0,2024-03-19 17:41:25,,,24.3.0
7d1bd0b2-051a-4e2a-9543-439cc7903152,Lhoy Manabat,https://play-lh.googleusercontent.com/a-/ALV-UjVdmPJaFxnxo0QwuRpGVV_reQNZ_ytSixsXOWtNu7qD83Y,FIX THE ISSUE AND GIVE US THE REFUND. I WILL UNSUBSCRIBE AS A MEMBER AND SWITCH TO GRAB INSTEAD IF YOU WILL NOT TAKE ACTIONS IN A HASTILY MANNER.,1,0,24.4.1,2024-03-19 17:25:38,,,24.4.1
3f4abd07-7fef-48cd-8a90-08668f0ead5c,Jas Abueme,https://play-lh.googleusercontent.com/a-/ALV-UjXm0iScndy9suFDCMyPqd1x0Uz7brd0h0Rhz1dRLuFTSKo,"I got an app bug where I paid a meal but did not reflect to their app. The total cost was deducted to my gcash account. I filed a help request but it seems like they don't mind at all. ps. IF YOU HAVE APP ISSUES, PLEASE POST A WARNING AT THE INTERFACE OF APP.",1,0,24.4.1,2024-03-19 17:23:43,,,24.4.1
da95c7e3-f40f-49d4-bbed-72d632162a64,jereneil fajardo,https://play-lh.googleusercontent.com/a-/ALV-UjX3FS_uHt7mHcR_olPVnvxFZ8Gcf_gUn9m-rXjDSLF_TA,"(paid order) but when you click the order, it will say ""something went wrong"" NO Live support! all useless automated response, poor app, poor support, no immediate response.",1,0,23.18.0,2024-03-19 17:21:59,,,23.18.0
bc76ebd0-c4e7-46a0-9e5a-4a2ee29be9d2,Rafin Mahmud,https://play-lh.googleusercontent.com/a/ACg8ocIh4mwqjwcyl7LcVcVF-KDP9wNl_jVot2Ngk4CrSUYC=mo,very good,5,0,24.3.0,2024-03-19 17:03:43,,,24.3.0
12bcffe1-7710-4b36-bef8-f3d111b3d4e9,Rich Riche,https://play-lh.googleusercontent.com/a/ACg8ocKfEzDMa_NJfaoDEHbryzfMnZJPbR482CBMjjkWKyIg=mo,Its a well meaned platform with fradulent practice of low quality product describe as premium to rip the customer off and no way one can return the product or don't have the attention to detail ability to describe a product accurately. e.g. Don't understand the difference between AA and AAA battery.,1,0,24.4.1,2024-03-19 16:50:28,,,24.4.1
4924b94b-ba92-4039-9414-15af973b9087,kshin chung,https://play-lh.googleusercontent.com/a/ACg8ocIR5TfqIXfTP_1T8PF-SbiA-Qt1L9ghImRcI1poNY-T=mo,"simple, easy and fast to order food",5,0,24.3.0,2024-03-19 16:46:25,,,24.3.0
fcfb35bb-6295-43ce-a6ba-de56ab35147e,Carmina Ramos,https://play-lh.googleusercontent.com/a/ACg8ocLNRnkNX8CaRxtbr3Ixb45q29EIJbzvx94Ag03nGiyj=mo,𝔤𝔬𝔬𝔡,5,0,24.3.0,2024-03-19 16:26:20,,,24.3.0
e91e5861-2655-4c09-a388-aa7a9486d146,jesse liam boshoff,https://play-lh.googleusercontent.com/a-/ALV-UjU6c6T_NNitmAgUzB2h9zHK5zcGhvCtIzeIeNXKIqJL56k,"What's the update na po?? More than 24hrs na ako naghihintay sa refund ko, no response from your cs, my order did not appear in the app yet the money was deducted from my account, no one answers my support requests, no mail from you! You just cancelled my order right after you processed my payment!! Not even a mail telling us what's happening??? Extremely disappointed right now!",1,0,,2024-03-19 16:13:10,,,
536411c0-7ed4-485e-b119-24d679c100f2,Poteto Arts,https://play-lh.googleusercontent.com/a/ACg8ocLhB6t5DHKaTifg_ipIHO4uim77-_lLfQDv7Cvy88BCUg=mo,Magnanakaw hahahaha,1,0,24.3.0,2024-03-19 16:05:35,,,24.3.0
eed8fec7-1841-4a32-8dd1-2f17186429aa,Michael Mendevil,https://play-lh.googleusercontent.com/a/ACg8ocKQpzQ__W2QsEdEqg7hWA2kFCLx2sMLXXlQkmS-VwaL=mo,very helpful application ☺️☺️☺️☺️,5,0,24.4.1,2024-03-19 15:50:16,,,24.4.1
0b9e9e9d-7f88-476c-8986-9e8925ab6caa,蔡心渝,https://play-lh.googleusercontent.com/a/ACg8ocL1IOm2fhODRk8pFQZ7yjZUSy_KZvESCccQt1tNMqQD=mo,Took my money but there was no food,1,0,24.4.1,2024-03-19 15:15:38,,,24.4.1
42709bd3-e44f-4b8b-a473-a6d15aaeaed9,Ji Ji Aung Waje,https://play-lh.googleusercontent.com/a-/ALV-UjUdYUUZCDhAy1DBEqtTLs6_IT1OhFDdb0ZZ7QRwl4PQ3ws,Kpay နဲ့ရရင် ပိုအဆင်ပြေသွားမာ,3,0,,2024-03-19 14:44:01,,,
93c4e661-aa0c-41e1-809d-c8fc5ab42cd4,Jayson Mugat,https://play-lh.googleusercontent.com/a/ACg8ocJLTgL8R5H-UpYfEVKhRujJZIl7EGg5pQaN8QlDD7wv=mo,App Went Wrong already deducted 938 pesos online payment then it will cancel automatically thru app then when we try to contact customer service foodpanda no one is answering. Please Helppppppp,1,1,,2024-03-19 14:43:00,,,
eb0c59fa-bbf9-43c4-974f-4e2fe1f818cd,Verified - Mizaki,https://play-lh.googleusercontent.com/a-/ALV-UjUzSpA-Xo0ZHt2UauDJgQQoQpiZwS0y1pu19kvJCjgoNQ,Really bad experience ive had on this and ive switched to another app,1,1,,2024-03-19 14:42:01,,,
cba7879b-5a71-4dcb-9e6b-476b11150e65,christine silatan,https://play-lh.googleusercontent.com/a-/ALV-UjXJhIzy2ZmyUj-RoT8kCAl_b3H-KoptUVVKohfNc42cu-Y,"Ordered food yesterday in mcdo ororama Cagayan de Oro branch using Food Panda delivery and already deducted money from my gcash, it already had a 15-25mins time frame of delivery then suddenly the order disappeared and I couldn't even find it in orders & reordering. Message you throu email and on the app but still didnt recieve a respond and a refund, can you please fix this this is really concerning and very dissapointing as I always use this app everytime!!",1,1,24.3.0,2024-03-19 14:11:35,,,24.3.0
f60f07bf-e273-4456-a560-8cd73188c034,哈呵,https://play-lh.googleusercontent.com/a/ACg8ocJ6wU3LEYMh_iK27a7N46xm5Jl0peII1oJGHAW9o9ql=mo,已經2024年了什麼時候要解決預約單功能的問題？ 要馬就不要給這個功能，要馬就在預定的時間區間內送達。店家跟外送員都看不到客人預約的時間結果提早送到，不只造成不方便提早領餐的客人困擾，也造成外送員得浪費時間等客人領餐。,1,0,,2024-03-19 14:09:09,,,
4a2faef1-8eda-440a-90a7-3862031a2163,monjur hossain,https://play-lh.googleusercontent.com/a-/ALV-UjWe5VT68Bod4J3EA-xxge_oTVzsdmf7HoK26OTwP_f0pQ,"A c,,o,*",1,0,23.24.1,2024-03-19 13:50:30,,,23.24.1
6584a879-deda-4137-997a-e4b06c37c741,Donny Ket,https://play-lh.googleusercontent.com/a-/ALV-UjVr9fUZizxCB60xCNs_vadGUBdb9wy3k_v6367QJf8c3l4,"Restaurant delays my order by 30mins (doubling the estimated delivery time), and foodpanda decides that if I want to cancel my order because of this I am not entitled to a refund. A company of clowns who don't care about you.",1,1,24.3.0,2024-03-19 13:34:42,,,24.3.0
