reviewId,userName,userImage,content,score,thumbsUpCount,reviewCreatedVersion,at,replyContent,repliedAt,appVersion
68bb5380-3fb4-4fce-b247-d3fac00bcc6b,12 Fm,https://play-lh.googleusercontent.com/a/ACg8ocIZOlZFwH_8KV5A1I4SpvkRaMtEJwAZkmzJxjMkektE=mo,good,5,0,1.58.1,2024-03-20 08:19:05,,,1.58.1
e052de6a-8a07-4ce6-b005-8b7b72dc1a3b,tony stefan,https://play-lh.googleusercontent.com/a-/ALV-UjUVIBzfcCuhJlNRjyoCkyBuUryr33c1rIlavRJ4YpD-WYnZ,"Itu maps nya di benerin lah, masa orderan mobil maps dari gojek nya pake maps orang jalan kaki / jalan motor, argo asli nya 10 kilo di penumpang jadi 1 kilo",1,0,1.58.1,2024-03-20 07:42:23,,,1.58.1
a99561a4-c838-4633-bd4f-b17568eeb81d,GUS ROMY,https://play-lh.googleusercontent.com/a-/ALV-UjUWEqYL9NxtFn-VNR7f8IuXtj6ZsQEaPfL2OFuZOOVkNeU,Niceeee,5,0,1.57.0,2024-03-18 14:15:27,,,1.57.0
3d00190a-cb02-4b4d-8484-a9a8ba7fe181,Hidayat Lawx,https://play-lh.googleusercontent.com/a/ACg8ocKEOTMaAR2ifWeLTEpFqGQcIt-z5fO0dFyDn_BGdR6Y=mo,kembalikan sistem yg bisa terima orderan meskipun minus saldo...sangat2 membantu untuk banyak driver...juga kembalikan lagi sistem yg membolehkan atur jenis orderan meskipun jam sibuk....setelah update februari dua2nya hilang padahal sangat membantu driver,1,13,1.58.1,2024-03-17 23:04:30,,,1.58.1
17c314a0-89a7-4700-b694-bab93e2868ad,Tuanku Berkelana,https://play-lh.googleusercontent.com/a-/ALV-UjW14g83tPzyP_vg3n6mZhZnS2_5rCqLFNQOCXtQMS47ss4,bad aplication ever.,1,0,1.58.1,2024-03-17 18:36:24,,,1.58.1
451197b5-f5ed-45cb-94c1-ee59fda5393d,Watakushi ID,https://play-lh.googleusercontent.com/a-/ALV-UjXD43QdWqg1r0Gy7CEJftszd5aNav5GG_rMCEy-NmRgHzc,"used to be reliable app, usually I can reached at least 14orders in one day but after the latest version it's hard to bid more than 5orders in a day, it makes not sense when I need to pick up for almost 5km+ from my current position. tried to contact the GoPartner team but won't solve the problem, how useless this app now. the previous version is way better.",1,0,,2024-03-17 14:45:53,,,
c3bb7cc9-47de-4395-80e3-4cfd05425c87,kyouzin hosaka,https://play-lh.googleusercontent.com/a/ACg8ocIsxwcOsQmnQRrT3yxYZr9z_G0oo3gEFSpF84f3y0Qv=mo,autis,1,1,1.58.1,2024-03-17 09:13:24,,,1.58.1
5a81cec2-190a-435e-a0a4-ea72db7cb7d8,Adly Husain,https://play-lh.googleusercontent.com/a-/ALV-UjXtT34Aa61eGdkfLLqhE2tE9dkPmxzX6O2Q7lPjnFZfYKo,OK!,5,0,1.58.1,2024-03-16 20:18:20,,,1.58.1
25097a3d-32fe-4ce6-b146-92bf7eeeff53,dedi iskandar,https://play-lh.googleusercontent.com/a-/ALV-UjVFV8zVzgx-3DQOjlO5-juI5XYgpSRgwmTPfA0PHMOvEg,Great,5,0,1.57.0,2024-03-16 07:58:02,,,1.57.0
87049791-3822-450e-8584-09429c502706,Hadi Novrizal,https://play-lh.googleusercontent.com/a/ACg8ocKrBaKhW1P5PNhQfNSsOTfwCS4xO3h6WTzk9OtpT9Xg=mo,Aplikasi ngambekan wkwkwkkk Aplikasi yg ga pernah fair dlm pembagian order,1,0,1.0.4,2024-03-16 02:33:04,,,1.0.4
bc72eca1-fa69-44f9-a202-b1444c0a4e29,AKTOR JALANAN OlishPeter (Olish Peter),https://play-lh.googleusercontent.com/a-/ALV-UjXBdf6ky4hmtk7gi7Kth_M2RZldqpJUNJ1eLueNXbPiOyU,Go-Jek makin susah orderan,1,2,1.58.1,2024-03-16 02:25:00,,,1.58.1
088915c2-207b-4247-962d-5db3c928b488,sky fire,https://play-lh.googleusercontent.com/a-/ALV-UjUopkrrAK17Ph2I0GTmawk9yYAIDGsKU16Vqglf2fqktw,gojek sg ....make a service for 13 & 9-seater minibus service at your app .,2,0,,2024-03-16 00:29:23,,,
717c7ef5-c11f-42df-89a3-cbfe7888271d,Imanuel Joshua Pungus,https://play-lh.googleusercontent.com/a-/ALV-UjUWTx4i6ltv4X2_8z4q48Hs1aE_f0pyXEMtX4vzT4r5Nkg,Thank you GOJEK ðŸ˜ðŸ‘ŒðŸ»ðŸ‘ðŸ»,5,0,1.57.0,2024-03-15 03:14:03,,,1.57.0
2a75bd52-f375-4e1b-8fd2-50f7156215c8,Gede Irwan,https://play-lh.googleusercontent.com/a-/ALV-UjWvYEE1bT7NWfbgib3qB5zCxR_hEkZKO6L8ovQzdmOMyRg,"Sekarang setiap saya tekan tombol navigasi untuk antar orderan, rute google maps yg dipakai sudah menggunakan motor. Good job atas update nya. Ditambah ada pilihan orderan",5,0,1.57.0,2024-03-14 06:24:24,,,1.57.0
81435001-1da6-4c97-976a-ee70ca4a5941,Riski Rizendra,https://play-lh.googleusercontent.com/a-/ALV-UjWiR4E7x6kDo2hSGeIqwgVib1tuSJnVa51bpCxLGv2nkH0,system masih belum bagus masih ada kecolongan orderan fiktif...,1,1,1.57.0,2024-03-13 19:50:55,,,1.57.0
112ef0e0-849b-4c16-873c-31ceb4f3bb81,Sixd Herdhy,https://play-lh.googleusercontent.com/a/ACg8ocLLx-yFD9jI_yEw0anCEwAG_R-bBW3B5ENeo8ISu2AG=mo,Good,5,0,1.58.1,2024-03-13 16:15:19,,,1.58.1
4dae4bf7-5d3f-423f-98aa-e5a5341efd66,Hadi Hutama,https://play-lh.googleusercontent.com/a-/ALV-UjVRcBy-sx6eUJx5u_cYyTJu8qOYvg0A1kMI07I76O8uWb0,Aplikasi tolooollll,1,1,1.57.0,2024-03-13 10:16:40,,,1.57.0
c2b1a47a-a55b-49e3-a170-b2cd0368e581,Choco Jabriq,https://play-lh.googleusercontent.com/a-/ALV-UjWz8vRyGk3Ix3DTLaGu5l3DnDGKwyzRVypJOAFGAI4RFA,Everytime update the new version its always impact when receiving an order and the accuracy of the distance in the maps never match with google maps...,1,4,1.57.0,2024-03-13 05:09:12,,,1.57.0
8a8bedaf-15db-47c9-a6d4-bca8be3763c9,Ivan Maulana,https://play-lh.googleusercontent.com/a/ACg8ocJNcH6LgG5abey1Ct-uMPN1dNnGgesFdLhLJcOLkgXX=mo,Sistem algoritma'y makin membingungkan,4,0,1.57.0,2024-03-12 21:52:11,,,1.57.0
92bbfd51-0166-421f-9563-6616528bcf74,Febi Riansyah,https://play-lh.googleusercontent.com/a-/ALV-UjWJamyPaqpbpEIV7TnVxU5W_HN6DUFicxiay2mNhihCcVU,Netes bener orderan kaga kayak dulu jedar jedor.,2,2,1.44.1,2024-03-12 14:19:14,,,1.44.1
17ba56e0-4beb-41d6-a145-71ecb37dcf2b,Iwanda A. 5313 T,https://play-lh.googleusercontent.com/a-/ALV-UjXgOtT36vhMNem2TjSSMlG_4hS5itwkZZxUbjrD6DuGc_9l,Tolong dong map bawaannya di rubah sedikit lebih user friendly. Masa kalah sih dengan apps sebelah yg sama2 ijo. Mapnya friendly dan lebih intuitif. Map pengarah ke tempat tujuan itu selalu by default set to north position bukan tracking. Alhasih agak wasted,3,0,1.57.0,2024-03-12 05:53:09,,,1.57.0
e7c2f802-46ad-42c7-97d9-34885467fd3c,Vadvoo Gaming,https://play-lh.googleusercontent.com/a-/ALV-UjXkap6u4Ka7YM_xq-yjurCfKaHZVWTJOKVijf3zjcYI70s,Driver gak diperhatikan kesejahteraannya,4,2,,2024-03-11 19:01:08,,,
e470dbde-2b5e-40e3-8ed8-5b546fd20cca,Meshal A,https://play-lh.googleusercontent.com/a-/ALV-UjWR9ZOQl_lygkNsFOf0kdk5ShyAeF6vJruKObGrXkTb3bU,Good,5,0,1.53.5,2024-03-11 04:27:18,,,1.53.5
3e4ac281-c41d-43c6-989a-beb4409de1bd,Irwan Kholistiawan,https://play-lh.googleusercontent.com/a-/ALV-UjXOQoaU7H6O5Ph8ID7yG3cKvc6tV-iM6nr1ZxT2vsrq7qw,Tolong di review lagi argonya,5,0,,2024-03-08 10:58:36,,,
bf49280e-c2df-4416-bd0f-c00ed40228ef,Jaran Edan,https://play-lh.googleusercontent.com/a-/ALV-UjXcsnATmj_LSxSOyBa8Kc65AwlPHyvI2wkiqhVxp2IA-Tg,"Yang bener ajalah jek masa iya tiap sore ujan kaga ngeblastnya ga kira2,,lama2 yg ada ditinggal customer begini caranya mah,,gausah ngikut2 sebelah yg jemput jauh tapi masih ada cs nya,,lah mereka murah cs nunggu lama juga ga masalah ini lu udah mahal suruh nunggu lama yg bener aja rugi dong,,,bikin kebijakan ya make otaklah liat sebab akibat",1,24,1.56.1,2024-03-07 19:57:57,,,1.56.1
7e26da4e-9367-4ec7-979f-cbd4d77e918f,Jamhuri Dincht,https://play-lh.googleusercontent.com/a/ACg8ocJeN8EUiRQELBPcF6phI5uhjPbM8J1eVNtWdsgwd09-=mo,SISTEM LU SAKITTTT,5,11,1.57.0,2024-03-07 14:29:47,,,1.57.0
93c55abc-f0da-4d6c-aa3a-6b729b13e51c,Latiff Ezer,https://play-lh.googleusercontent.com/a/ACg8ocK9bv3VMtKRUufHW67Sc45qsQOmegN4fvEaPUHa7HBDKkg=mo,The far pickup very scary!!Limit to 6 or 7mins max to pick-up. 12mins is crazy!!Almost reaching destination passenger cancel!!ðŸ˜€,3,2,1.57.0,2024-03-07 05:06:15,,,1.57.0
942f4196-8ad7-47a1-a3fd-72c6d2d46388,Ricky Arya Saputra,https://play-lh.googleusercontent.com/a-/ALV-UjVUwSTVqAG-NDcunA0zwJ8XrIS8SBGjZZ8itkZQLSo4NS8,"Anda tau ""Sampah""? Nah ini dia salah satu contoh sampah! 1. Ongkir Gomart udah turun dan jadi sama kayak ongkos minimum gofood (dari 10.400 sekarang jadi 8.800, poin tetep dihitung 1) 2. Biaya tambahan ongkir food di atas jam 11 malam-6 pagi + belanjaan di atas 200.000 sudah dihilangkan 3. Kebanyakan biaya ""siluman"" yang memberatkan pelanggan ketika melakukan pemesanan gofood Selamat, Anda beserta jajaran Anda sudah berhasil sign up menjadi kelompok zolimðŸ”¥ðŸ”¥ðŸ”¥",1,12,1.57.0,2024-03-06 00:08:49,,,1.57.0
85bcc1fa-b84a-40f5-91af-3a4f42b2a4f0,Muhammad Subhan Yasien,https://play-lh.googleusercontent.com/a/ACg8ocLYCfFBXOJQAeIN3KojiuI4f-KXIVFqeyXE9QWzMbd8=mo,Aneh innova 2015 gk dpt luxe lg,1,0,,2024-03-05 22:32:16,,,
76552a3e-908f-46dd-988a-7084313664ad,zhenxing fu,https://play-lh.googleusercontent.com/a-/ALV-UjXjvrDbTVO_lHGbB7cizxOKWG0y2wv7u8JYkt2PHICaaYw,Cannot use at all,1,0,,2024-03-05 01:52:43,,,
09b16d16-1f97-415f-b4b1-6d15f6d58d30,Vino Amora,https://play-lh.googleusercontent.com/a-/ALV-UjXO-U8cpopddokGsQ372fFPmzWTvBchQyI5a-MLCnOo83Q,Susah dapet otp,2,1,1.38.1,2024-03-04 00:08:03,,,1.38.1
259427b0-3b69-44dd-b925-ae4004d0815e,Widi Aprianto,https://play-lh.googleusercontent.com/a-/ALV-UjXIaGaIfByz-QfZvt5ug17V5vbjzCGO-2tmWMYe9IzktRM,"Aplikasi sangat bermanfaat sekali, karena bisa untuk pekerjaan sampingan",5,0,1.57.0,2024-03-03 22:13:26,,,1.57.0
87477a37-b42c-477d-be64-bf99ea4b0cb2,Us Denim,https://play-lh.googleusercontent.com/a-/ALV-UjU81Xv9gTrDrg8scF-H-Zb_KC9snEYtKzcyksB6qEwy2Yo,The verification code doesn't show up.,1,0,1.57.0,2024-03-03 18:30:49,,,1.57.0
c295eaed-7eb5-4ca6-8c6b-f35d4cc1d2e0,Zwachhelmut,https://play-lh.googleusercontent.com/a/ACg8ocJgT71D9OI8uVtGZFCrtYs5r3HWpjCQGsDjz99pF2tY=mo,Abis update terakhir jadi boros baterai jancokkkk,1,4,,2024-03-03 09:32:08,,,
ebd11aad-5fc3-4289-bb71-02ded6c431c4,Muhamad Yusni Kamsani,https://play-lh.googleusercontent.com/a-/ALV-UjW2IvCMiawajtKLYd7HruhRVC6G8gceWN9N4rjU7SL2kvh2,"Please improve the app. Its terrible when you are nearing or almost completing a job, your GPS (Waze/Google maps) page is ""turn off"" due to incoming jobs. There are plenty of drivers out there including myself need to use the GPS to drop off passengers. Everytime jobs came in, i need to ""turn on"" again Waze or Google maps. And when i restart Waze, it will ""turn off"" again due to incoming jobs. Please fix these problems. This is for drivers SAFETY too !",2,7,1.57.0,2024-03-02 19:53:59,,,1.57.0
602a8d01-de03-4674-8361-8e4387bc7f60,JnJ,https://play-lh.googleusercontent.com/a/ACg8ocKKU-naOTZGh7gDCvQCTwKG7XHmtHgZprJO3Y19PyZh=mo,Mantab,5,2,1.56.1,2024-03-02 16:27:42,,,1.56.1
270fc5da-92fe-4adb-907e-23dcb70d3dee,Rianda A,https://play-lh.googleusercontent.com/a-/ALV-UjWjduyKTh-KXAAy5hbJ4zrxOlRrgFkxzU_yxIahANCLYH0,"Baru nyobain aktifin 3 hari, hari jumat 1 maret, sudah full dpt insentif sesuai syarat harusnya dapat pendpatan tambahan 180k. Hari ini, 2 maret cek malah gak ada lagi keteranganya, duitnya gak masuk, mau laporan kudu ada screen shot, mana gue tau perlu gituan, astagfirullah. Mana pas nyoba full ngebid dari jam 1 siang sampai jam 11 malam tgl 1 maret tu ujan di jakarta dan sealalu dpt penjemputan yang jauh jauh, tapi di anter deket, berharap dpt insentfi malah gini. astaga naga ni aplikasi",1,1,1.57.0,2024-03-02 10:26:44,,,1.57.0
76647b95-b5e4-4c2f-982d-219f5a8374b2,yuli eko eko,https://play-lh.googleusercontent.com/a/ACg8ocKxm7hTUj5r5W0VoRelR3gQKGaQrOigh__6eWPLYBFQ=mo,"Aplikasinya Gocar tidak fleksibel terutama mapsnya tidak sesuai dg yg dibuat pelanggan sehingga driver Gocar mengalami kerugian ongkos dan BBM karena jarak jemputnya 3,5km s/d 5km sedangkan jarak antarnya kurang dari 3km........",1,2,1.57.0,2024-03-01 19:42:38,,,1.57.0
2027adac-8ad7-482e-b901-30fe3843de1f,Jekeof,https://play-lh.googleusercontent.com/a-/ALV-UjWmCiIVXihLSOhYtYoDw_opQI-R_GT_tWrCqWX9QDv12yU,"Kebijaksanaannya jarak tempuh (diatas -+ 500 m) menjeput oderannya, jikapun memang harus menjemputnya, hqrap diperhatikan tambahan tarifnya mengingat menjemput orderanpun menggunakan bensin, tenaga dll. ===== Update terbaru kebanyakan ini itunya untuk transfer uang Berbelit-belit, ga memudahkan malah merepotkan, mana harus tambah aplikasi lain (gopay) Udah cukup bagus seperti sebelumnya, malah ditambah ribet, tambah ruang memori di perangkat, kurang tahu nih kena biaya adm transfer ga ya?",2,2,,2024-03-01 09:50:37,,,
6648b946-fdae-4282-8e56-4f394225188e,zaky andi,https://play-lh.googleusercontent.com/a/ACg8ocI2ZtzC1kp5o90ZBCb7rTaSmwY9BWnJdQD8vtXoY-Uh=mo,Too much bug!,2,1,1.55.0,2024-02-29 23:39:06,,,1.55.0
3a3dc5ab-7d64-4988-867b-debb74d3e46a,Chop Sticc,https://play-lh.googleusercontent.com/a-/ALV-UjUNIm0gwCbSFbFN7RHV7lF3zTRCLi4EF3L36hVlqZ9WC3I,"5 jam keliling2 kaga dikasih2, giliran udah sore dikasih buangan jarak jauh, 5 jam akun gw dikemanain aja?, okelah tetep gw bawa, tapi masa iya seterusnya kaya gini?, selalu jadi pemain cadangan, tâ´i bâ´bi",1,5,1.56.1,2024-02-29 11:39:23,,,1.56.1
058eeeb6-51f1-41ff-9585-832ff557f637,De Master Nugy (De master),https://play-lh.googleusercontent.com/a-/ALV-UjWZfTVBHHa15z7kJ7hTPv7k1aMmFyUuWUc9y8tTiaKYnQXK,Mntab,5,0,1.57.0,2024-02-28 18:08:03,,,1.57.0
01008589-5501-4e58-9026-8834c30b9f78,Adi Sugondo,https://play-lh.googleusercontent.com/a-/ALV-UjWAe5u_a9bddcMsmDO1jtj279-RlgLce4EvKLCn6O5t50M,Aplikasi telp yg disamarkan sering error masuk pesan suara ðŸ˜•,2,1,1.55.0,2024-02-28 15:58:16,,,1.55.0
fa7c0248-4f25-4dba-979f-f37561524361,Fajar Fajar,https://play-lh.googleusercontent.com/a/ACg8ocLjDvkkvArioz7Rlu2Zxm_ssKfE_HAq6ggwDJ5CGInC=mo,Satu kata untuk aplikasi ini. JANCOOOOKKKK!!!! Vermuknya bikin jengkel,1,2,1.17.1,2024-02-28 15:28:02,,,1.17.1
f7aa4887-662a-49e7-b016-b6ed5caa7800,Kiki hariyanto,https://play-lh.googleusercontent.com/a-/ALV-UjXhPDuZIAYiBNzoEkCjHfruqw8u8ReFaJ55jPBCXRv9KS8,Kapan dibuka lagi pendaftaran driver Go-Jek reguler ??,3,3,1.39.1,2024-02-28 14:53:53,,,1.39.1
a6ea4c35-8236-4941-a318-3f97da0e46ac,Dani Hardiansyah,https://play-lh.googleusercontent.com/a/ACg8ocIkuJgNpTMJhK2vUt3N5GZco0EFklzR3TxfU1LEGBgq=mo,"Review jujur driver. Aplikasi paling ribet didunia. Pendafatar Dari 2 bulan yang lalu sampe skrng gak jelas kabarnya. Satu Lagi untuk CS nya kalau mau validasi dokumen sekali jalan, jangan hari ini minta perbaikan foto ktp 5 hari kemudian minta foto diri, 10 hari kemudian minta foto ktp Lagi. Make it simple tapi terarah!",1,1,1.55.0,2024-02-27 11:17:45,,,1.55.0
87e049da-cf9e-4600-baa4-0318d1cb1d92,Mr Jhonny Orange,https://play-lh.googleusercontent.com/a-/ALV-UjWXcgSrEtWDXiAbVA_9heL5BS-kILHG1DXl7EchIjR0UQ,"NAJIS! SAMPAH! BOBROK! ZOLIM! Orderan food gabungan cuma ditambah 2.500, uang tambahan ongkos food di atas jam 11 malam - 6 pagi dihilangkan, biaya ""siluman"" pesanan dinaikin, argo masih segitu juga padahal segala harga kebutuhan udah pada naik! MAKAN NOH UANG HARAM HASIL KERINGAT MITRA LO!",1,3,,2024-02-27 03:15:04,,,
f6961a51-aefb-4501-92f2-60408ae2513c,MRT 9,https://play-lh.googleusercontent.com/a/ACg8ocKkL_w8LWKZiiFTFIAr3hOfz5-sZI_Jjh3p-Y4vFWDvJQ=mo,NAPA NG BISA LOGIN YA???,2,3,1.56.1,2024-02-26 07:41:48,,,1.56.1
f7136170-daef-4c68-83e8-1fa47a86b764,Frizal Andika,https://play-lh.googleusercontent.com/a-/ALV-UjVC_8FsqXFw_t9wYvLMsYkXhetn5sqtjMMlfzfjxFbd5w,"kenapa butuh akses lokasi sepanjang waktu? harusnya waktu aplikasinya digunakan aja, aplikasi kompetitor ga perlu akses lokasi sepanjang waktu lho",1,4,,2024-02-24 16:17:17,,,
3c6d768b-8acc-474a-bd95-ea3224b815ab,HendiX,https://play-lh.googleusercontent.com/a-/ALV-UjWaGWDHbjPGQDHquQKoPKqtFxhSLSWcQvv1qdRR9TWXjt0,Percuma loyal,3,3,1.56.1,2024-02-24 14:50:06,,,1.56.1
7f5d61d5-6743-4c4c-a65c-821f301364a9,yonathan jerry sibarani,https://play-lh.googleusercontent.com/a-/ALV-UjUxJUPwDrCIf-HREWzJHboO-x-5g7AROUJSFIlGIm5cSQ,ini applikasi utamakan apa sebenar nya ?,1,2,1.56.1,2024-02-24 11:57:18,,,1.56.1
d86d4bae-2b5b-45f9-a9b6-288b8329ce7d,Pingky Gunawan,https://play-lh.googleusercontent.com/a-/ALV-UjUyPHEg7TrweM_v8RzzLAKzEcieinYYxGc73prB7DrgOCE,"masih suka error , potongannya banyak , harga per km masih sama seperti 5 tahun yang lalu (2017) hanya 3000/km , tidak naikÂ² padahal harga bensin dan kebutuhan lain sudah naik ,, gak bisa hitung kayaknya nih gojek , inct skeranga gak ada gunanya ,, dulu 17 trip 400 24 jam ,, sekarang ? disuruh cari 10 trip jam 6 pagi sampai jam 9 hanya 50.000 ?? ðŸ¤£ðŸ¤£ðŸ¤£ kalian kira kita ini nyetir bajaj ??? kalian kira biaya perawatan mobil murah ??? edit: sudah 2024 , titik pengantaran suka salah ðŸ‘ŽðŸ‘ŽðŸ‘ŽðŸ‘ŽðŸ‘ŽðŸ‘ŽðŸ‘Ž",1,9,1.56.1,2024-02-23 19:03:32,,,1.56.1
9bc0543a-d2db-4459-999c-8002ab9c355d,Agus Setiawan,https://play-lh.googleusercontent.com/a-/ALV-UjWHXS4QHwA9dXBYEv2JfLBwZXWwz7BX4XK_L9rHDEgMJtY,"Akun stabil tiba"" jadi gagu..kacauu",5,4,1.56.1,2024-02-22 10:26:15,,,1.56.1
bb490c23-5daf-48e6-8963-ed886d53b43b,Hengri sudiarto,https://play-lh.googleusercontent.com/a-/ALV-UjUCFWj3icqEEyupa9hR6oW4Tpm8nFxcXokaT0KULFcDQqA,makin hebat ini gojek ga jelas makin kebelakang. Dulu.orderan bliebird duluan.skg gofleet lagi. Emang perusahaan pemakan keringat orang. Makin ga jelas loe,1,3,,2024-02-22 08:19:39,,,
3d6ba67e-b460-4fb3-81bb-728bf495dd39,Deddy Mayor,https://play-lh.googleusercontent.com/a/ACg8ocJdoaMU43hC5Djgie0F4xLbDol5SoYPj4ov4lnVbTLa=mo,"APLIKASI KAPITALIS SERAKAH DENGAN SISTEM BUSUK! MAIN GOFOOD KAYA NGELONTE, ONBID SEHARIAN DIDEKAT RESTO, MUTER SANA SINI TIAP HARI SEHARIAN KALAU JATAHNYA BELUM DAPAT YA GA MASUK ORDERAN GOFOOD! MAIN GOSEND AMBIL ORDERAN JAUHNYA GA KIRA KIRA ONGKOSNYA SANGAT SANGAT MURAH! MAP MAKIN NGAWUR! AKUN UDAH KAYA ARISAN GILIRAN JATAH GACOR MAU DIMANA AJA ORDERAN YANG YANG NYARIIN DRIVER, ANYEP MAU MUTER KE UJUNG JAKARTA JUGA GA BAKALAN BUNYI! KEBANYAKAN MELIHARA BINATANG BUSUK DIDALAM SISTEM SERVER!",1,2,1.56.1,2024-02-21 13:24:13,,,1.56.1
3fc85f65-c1f0-487b-b0fb-d8d8ea1cb921,A Ferdiansyah,https://play-lh.googleusercontent.com/a/ACg8ocJS0Fop6PTQpY30xA8NbHDpv9jFYKiRaBJe9dsqfTDQ=mo,Aplikasi laknat...membunuh driver dgn argo gocengnya...semoga program acengnya gk laku..dan balik lg ke argo normalnya,1,1,,2024-02-20 22:10:56,,,
216bd39b-52f9-4214-9172-957a857a77fd,Brillian Agung,https://play-lh.googleusercontent.com/a-/ALV-UjWtTZPwUx_sXdo2j_s0UGmV2M58GyMQkhjJeYc0GPWLj4E,"Alasan memanipulasi verifikasi muka Untuk para driver lain hati hati, menghidupkan kamera lalu memantau dari kamera handphone tanpa sepengetahuan dan perizinan pemilik handphone, melanggar hukum Bangkrut ajaa saran saya",1,3,,2024-02-20 12:27:34,,,
104ce9b0-127a-4e39-9391-6348ca462d44,fakhrul roji,https://play-lh.googleusercontent.com/a-/ALV-UjU0bHIr6DbEcLRnbRUH_L9y9rGmaJ7-UUIox89NToSzHDo,"Vermuk terbaru gagal, mau narik nyari duit ini gmn si",1,0,1.56.1,2024-02-20 09:42:11,,,1.56.1
e3e47d3b-2c84-4d36-92fa-e8626f9ba537,mesaiky channel,https://play-lh.googleusercontent.com/a-/ALV-UjX16px7Wd5uRZ1AFCFM0JjSqVjLvp2UwGJaYcHzrENML9U,KEBIASAAN... abis update LANGSUNG ANYEB GA DIKASI ORDER,1,4,,2024-02-20 08:22:46,,,
2eb263f7-07bc-41f0-9b6d-194437b7504b,Bryan,https://play-lh.googleusercontent.com/a-/ALV-UjUCyTNxQxnGOlIYoU7VXC5snZNtE9-usYOAjngCFM4bK9Tl,Sangat membantu,5,0,1.55.0,2024-02-19 22:43:44,,,1.55.0
050ea74a-0316-4c1c-bae4-dcd6dc9d45ac,ketut wigama,https://play-lh.googleusercontent.com/a-/ALV-UjU-TWBe4-gVEp5EqKkc2y6XkoOGo2lJ-c16DAUUJYxAXnQ,By updating regulary the app become so up to date and smooth.,5,0,1.56.1,2024-02-18 23:01:22,,,1.56.1
886068fe-23dd-4131-a484-e3242e8a8d69,Sky Light,https://play-lh.googleusercontent.com/a/ACg8ocJ1MGkcMEL1HAACdLZJ7annFpjjFjBbR75AKzkZgxHk=mo,5 years in Singapore their app still poor horrible location booking all far pick up suck app go home better. Never pay out waiting fees worse than grab... gj die soon and never take care of driver .shame on u,1,10,1.55.0,2024-02-17 20:48:31,,,1.55.0
0f4c9a53-0667-442e-a794-90ae84a9de97,Tedy Sanjaya,https://play-lh.googleusercontent.com/a-/ALV-UjVazt7POIxJApDsjoF8le-txIEpT_U4cpunL-8t2C7NHw,"Orderan Fiktif GoShop, anda tidak dapat memberi Solusi... Sudah",1,3,1.55.0,2024-02-17 14:11:42,,,1.55.0
86610b8d-bc94-4251-97a2-7a03cd247620,zulkarnain â€œizulâ€ ari,https://play-lh.googleusercontent.com/a-/ALV-UjVV5SEhLTNQUvxYDRNx_dxU2DbLgjJfzSqm27u5SnFOjA,mantap markotop,5,0,,2024-02-17 02:56:05,,,
0a96520f-ccd4-4997-98b7-6eb0170c85ad,å–œå¾·-Pay Eng Kiat,https://play-lh.googleusercontent.com/a-/ALV-UjX74XcFsDdVudXhkfIphG9Eclc1tD_XgV91vc1X6WmNdcY,Y isit spilt view had been disable. Help,5,0,1.55.0,2024-02-16 11:21:14,,,1.55.0
8d0c1af3-cee6-47b8-9006-8cab0a146441,Yohanes Hamdani,https://play-lh.googleusercontent.com/a/ACg8ocIl14cF-Hpz7U_OFOavC_1KHF5e2Om5cBe5DyHjVry5=mo,Please DARK MODE,3,0,1.55.0,2024-02-15 23:14:20,,,1.55.0
c433ab26-8909-45fc-aa74-8f2e34accaeb,Goody Goody,https://play-lh.googleusercontent.com/a/ACg8ocJrQFNDq6-ZCzuXaS0gEY94d7a5vdEHyZovRPNHkRpH=mo,"potongan komisi utk gojek/kantor gojek, biaya aplikasi, dst itu seharusnya klo di total maks. hanya 5% saja.",1,4,1.55.0,2024-02-15 19:22:54,,,1.55.0
df5c5320-dffb-46be-9d68-67a7f19afc95,Mardhatillah Mardhatillah,https://play-lh.googleusercontent.com/a/ACg8ocLH7tNJ_eOHN0qC7UtlgXE31EGNtxz9svc5klxF6DB5=mo,Udah berbulan-bulan belum di verifikasi,1,0,1.55.0,2024-02-12 15:49:53,,,1.55.0
e499f349-6611-4302-a121-883f6566e58c,Agung Tri,https://play-lh.googleusercontent.com/a/ACg8ocLJGI2qqlWY8s6eXPzmoqnQHnMHnHqkJt1V6bkZVMDp=mo,Sudah bangjrut aja sekalian biar tidak banyak orang yang berharap pada aplikasi ini...,1,4,1.55.0,2024-02-11 13:05:52,,,1.55.0
17b162e6-c9ee-4b19-a48a-38062a8a0d5e,Nic â€œLeoâ€ Liu,https://play-lh.googleusercontent.com/a-/ALV-UjWg0M_4cbVWqny33gKdc7u9LzM9Ca_LFjw8T-8n24xcBw,"This is a platform that has too many cancellations and drivers waste a lot of time and petrol. Do not rely on the app to give earnings, started at 4am everyday started getting jobs only after 6am, no jobs in the afternoon and hardly any even at peak hours in the evening, good at times but earnings will be restricted after earnings get close to 300, hardly earn enough, used to get back to back jobs but only to find that its because due to no drivers or low drivers like during Chinese New year",1,20,1.55.0,2024-02-10 18:23:30,,,1.55.0
6788532f-ea57-489b-aa33-e5705b5a1dbb,Peter Puah,https://play-lh.googleusercontent.com/a/ACg8ocKyKgqf6H75Q49JjuxjfVxWy90_iqF2TeUcvjLlmzGA=mo,Cannot install and disruptive,1,0,1.54.1,2024-02-07 22:39:45,,,1.54.1
c42fc1b6-e1c9-4fcf-9525-eb60f7c84e6a,RDYS,https://play-lh.googleusercontent.com/a-/ALV-UjWR0k5p1LTaQp-yDxl9JZaBh_eMGLr0j9i9dQ_-vpRE-Ww,Aplikasi makin di perribet dengan fitur baru udah bagus bisa pilih transfer ke gopay atau bank malah dibikin ribet lagi hadehh,3,2,1.55.0,2024-02-07 18:19:09,,,1.55.0
73c5132e-3101-413d-aaaf-23dcdc2decb1,big joe,https://play-lh.googleusercontent.com/a/ACg8ocKx8K95Bmtmy5-fUkSdEW-5JSVurA2PpXn7Eq8FP701=mo,"Murah banget bayar mitra, kaya bayar babu",1,2,1.54.1,2024-02-07 17:54:06,,,1.54.1
8d665aff-8057-4376-b652-e9867357a0d2,One Dee,https://play-lh.googleusercontent.com/a-/ALV-UjVs-3MbZkburBpGEiWwfTer7LprvCGTBMsHAxwcGoDwdg,Anyep,1,1,,2024-02-07 13:03:31,,,
2e710d45-0804-40b1-8d14-7320aba3e029,Irfan Fikri,https://play-lh.googleusercontent.com/a-/ALV-UjXjiQYRphvo3rLQU-xXb99tFkQ6C2eVl-Nla37AMTle164,Saya sebagai driver merasa tarif nya parah banget skrg,1,1,1.54.1,2024-02-07 01:46:29,,,1.54.1
76f61383-91f2-4818-9eac-e983ed555888,10 goku,https://play-lh.googleusercontent.com/a-/ALV-UjUkwyL_gWQkMX6XFxyj6i_jQGVW9aikP5e717zVofIvkB4,"Titik jemput selalu dapat 2km+... Jemput jauh harus ny ada kompensasi dari gojek, payah",1,2,1.55.0,2024-02-06 20:35:40,,,1.55.0
05ea90b9-9163-4893-b3a9-7c1a569ecd83,Andrik Prasetiyo,https://play-lh.googleusercontent.com/a-/ALV-UjVRUxe8HmAMMDEg7bV9H_hrlZpOPjMfs3Dx4UW8SJ8aTQ,"Baru bener2.karya anak bangsa, sampah banget aplikasi,.banyak masalah",1,2,1.55.0,2024-02-06 17:06:50,,,1.55.0
ac82f673-eca6-4641-881e-a6989847e8ac,Mr. Mabroex Basbeth,https://play-lh.googleusercontent.com/a-/ALV-UjX8zUi9TTYgFOwGevBn4peNqaEFYrBFmrjb6inskHbjQM0,Jos,5,0,,2024-02-06 06:10:36,,,
bbed86fa-1120-4efa-b1e5-c7a6908a65c8,Rico,https://play-lh.googleusercontent.com/a-/ALV-UjVwNQofYiL1bBSJunZhqhINehrI-IkAu3xEefJlCC_63YE,"Ekspansi2 segala padahal produk utama & pertamanya ojek daring. Itu aja fokusnya, gimana caranya supaya gojek jadi pemimpin pasar lagi ðŸ¤·â€â™‚ï¸",3,11,,2024-02-05 17:34:46,,,
a2d7a36c-5bf4-4f3c-a244-f5c77cffdd35,Bagus Aditya,https://play-lh.googleusercontent.com/a/ACg8ocIG4SsNEsUQPjd5w0UpOF5MImvdMdAYvL1uac2XSdUa=mo,Aplikasi yang buruk. Hanya cocok untuk habiskan bensin di jln dan menambah kilometer pada motor!!!!. Aplikasi yang menyubang kemacetan Den selalu mebukak pendaftaran driver tpi tidak ada orderan yang memadai!!..tolong di pikir juga yang di lapangan. Membuat Miskin secara perlahsn!!,1,9,1.55.0,2024-02-05 11:12:21,,,1.55.0
ae491556-627a-4b78-8994-0bf6b03f65cb,Imansyah â€œá®„á®™á®”á®ªá®¯á®‚ á®ƒá®žá®ªá®’á®¢á®•á®¢á®â€ Ap,https://play-lh.googleusercontent.com/a-/ALV-UjWUdpbfeqkWe7Z6rN6G1znzc4f925gg-tljg7WDcWYdQwWo,"á®žá®¤á®›á®©á®™á®ª á®‡á®Œá®¨ á®Šá®’á®¤á®”á®ªá®Žá®Šá®ª-á®’á®¤á®”á®ªá®Žá®Šá®ª á®’á®©á®„á®€ á®™á®‚ á®’á®€á®’á®¥ á®á®¨á®Œá®¨á®œá®ª, á® á®œá®œá®ªá®” á®…á®”á®ªá®’á®¥á®Šá®ª á®Šá®™á®¤, á® á®›á®™á®ªá®” á®Šá®©á® á®™á®”á®¨á®‚, á®ƒá®•á®£á®¤á®Šá®’á®§á® á®˜á®¤á®ƒá®“á®˜á®ª",1,3,1.55.0,2024-02-03 23:09:14,,,1.55.0
cc2aaf24-c9a0-4c60-b25c-16ce221de3b7,Agus Ayahab,https://play-lh.googleusercontent.com/a/ACg8ocKrRbPluNXh5SIqBfZhxXYe_mov7OfgSlNMtweTMks4=mo,Gocar tarif tidak masuk akal. Belum terpotong saldo waktu mendapatkan order. Tarif 12.000 Potongan saldo 6.000 Dapat cuma 6.000 Jarak yg ditempuh 9km,1,3,,2024-02-03 21:05:16,,,
