reviewId,userName,userImage,content,score,thumbsUpCount,reviewCreatedVersion,at,replyContent,repliedAt,appVersion
b1ba023c-f9e3-4923-9c5f-8f472b92a77b,Irwin Irwin,https://play-lh.googleusercontent.com/a/ACg8ocI_d-PHnW7ddjOHtP9awIFcL8WVDB5GGFr-By6weO3o=mo,Pendaftaran saya tidak pernah diapproveâ˜¹ï¸â˜¹ï¸â˜¹ï¸â˜¹ï¸â˜¹ï¸â˜¹ï¸,2,0,1.53.5,2023-12-30 09:19:00,,,1.53.5
a19aa9a1-1adc-45f1-8fd6-8708c0cd8e8d,naran toko,https://play-lh.googleusercontent.com/a/ACg8ocIA9P-q9GzqQVHF1fVRawq58K_EXOTmxhwJb7oOdk9s=mo,Akan lebih baik ada dark mode agar pada siang dan malam hari dapat dilihat oleh driver pada saat berkendara,5,0,,2023-12-25 10:57:41,,,
7fb833e6-c3b6-41bc-9cc1-78faf63b0c11,Aka Suryadi,https://play-lh.googleusercontent.com/a/ACg8ocI7EDIo6nR5avNujhaXrtItQQpO_xag8yW55Rbv2wtd=mo,Uang driver dikeep gak bisa diambil,1,3,1.53.5,2023-12-25 09:16:02,,,1.53.5
c9bc1063-bfde-4a64-90f3-40d007934774,Haddy Sutanto,https://play-lh.googleusercontent.com/a-/ALV-UjXjrFRpvo1O8u37O9dTf5RDB5PNRxHAM6b59Ah_DEM79Q0,"Titik jemputnya gak kira2 jauh bener bisa lebih dr 5KM padahal kita (driver) dibayar hanya ketitik tujuan/antar tidak ketitik jemput, dibilang sistem lg eror tp hampir tiap hari begini terus harusnya ada batasan kilometer untuk titik jemputnya, tolong segera diperbaiki! Trima kasih.",1,0,1.53.5,2023-12-22 13:23:35,,,1.53.5
4a02d2a7-82c4-4790-bfea-04c736465eed,Muhammad Akbar Indrayanto,https://play-lh.googleusercontent.com/a-/ALV-UjUZf0R9kBcKE3G_taMl8rjXkqiR1f1kUchKI86x01eGAgc,"1. Mohon ditampilkan kembali data dari penilaian kinerja. Walau tanpa penilaian seperti jam online 1 bulan, penyelesaian dan penerimaan order 1 bulan. Data tersebut sangat membatu proses revovery akun setelah libur lama. 2. Aplikasi sering mati saat di background. Hal ini sangat mengganggu ketika sedang menjalankan order jarak jauh dan saat jeda order agak lama dari biasanya. 3. Tolong tampilkan lagi nominal tagih tunai di halaman histori order.",3,1,1.53.5,2023-12-21 22:53:34,,,1.53.5
a88dd7a6-3dfc-45d2-bfe9-7c868ae3eea6,Hudha Nurul,https://play-lh.googleusercontent.com/a-/ALV-UjV8fM4JWxenogRseL108LnrzTxKCPOa3Eq9kjE9X8wCuY4,Aplikasi yg fair untuk driver go car dibanding yg sebelah. Sukses selalu gojek n team.,5,0,1.53.5,2023-12-21 07:30:02,,,1.53.5
cd3efe0d-c107-4e2c-9c67-98a92454162c,Choerul Ikhsan,https://play-lh.googleusercontent.com/a/ACg8ocLvRQeLrR11ZEsB8oQhawdy6T3OhNdeutqbYZlTs4u_=mo,Keren,5,0,,2023-12-20 01:48:46,,,
88adc5a1-2365-4ead-8eb7-24f645b6b174,i ketut pariana,https://play-lh.googleusercontent.com/a/ACg8ocIKpI3lSY3WKMfV1HuigH4GY59LnacHfDDsRCFatlwB=mo,"Thank you so much , i am very with go car , very essay to work",5,0,1.53.5,2023-12-18 16:17:09,,,1.53.5
6c5d21d0-c552-48cb-9eb8-0ec782e4cc87,Gibran Toto,https://play-lh.googleusercontent.com/a-/ALV-UjWzxL60-voTUEtGZgkhck_cJ5s1L4APyYXvSlDDzr0jwW0T,Cannot register for more than 6 months,1,1,1.53.5,2023-12-18 12:34:31,,,1.53.5
11e06842-ff7d-4991-9bd0-0bb7e7bba382,Irfan Baikbgt23,https://play-lh.googleusercontent.com/a/ACg8ocLJPaU6IxFUwb3RzishsTBOTDGCe7E7isl3GNAOy4go=mo,"Driver tipe aceng atau jarak dekat tolong di review kembali jaraknya dan penjemputan makin gk ngotak, diambil semua juga jarang tutup poin. Masuk mall dan apartemen pula gimana mau tutup poin, sedang motor jalan terus tidak sehat juga banyak perbaikan pendapatan alhasil 60% bensin dan perbaikan motor saja, hanya 30% bersih untuk rumah tangga.. Mohon di perhatikan kembali tutup poin bonusnya",1,3,1.53.5,2023-12-17 20:14:15,,,1.53.5
f7b7bee0-0c7b-4a97-847a-b4de7569f921,Senja Sore,https://play-lh.googleusercontent.com/a/ACg8ocJHghnik7GRUZXuZQw1ddZRBk0EseZyN6x-IFA8N_1r=mo,"Semua akan diminta per tanggung jawabannya kelak, dzalim sekali kalian cs bayar ongkir normal driver cuma terima 2rb cuma karena alasan double order. Belum lg mitra jarak dekat 5rb yg mana anda tagihkan ongkir reguler ke costumer. Semoga kalian dilaknat",1,5,,2023-12-17 19:53:04,,,
a428ac05-7915-4864-a4b7-053f45cd9eb7,Rider On,https://play-lh.googleusercontent.com/a-/ALV-UjUskI0x7NmKCnmP7vzZXuQj_xB1p0gC7ECwMfT1rtnSVQ,Payah,1,0,1.36.2,2023-12-16 21:14:21,,,1.36.2
db6fbfd1-f174-4159-8f98-015c64a3b826,reza echa,https://play-lh.googleusercontent.com/a/ACg8ocJRymP7DvNVfnK4Vi3-JRHnlcfw61YsHvOoi37Mucpl=mo,"Cerita Driver Aceng : Belakangan ini beredar postingan tentang Mitra Jarak Dekat besutan Gojek bisa dibilang mitra ini adalah mitra prioritas untuk mendapatkan orderan jarak dekat Postingan yang beredar bahwa mitra jarak dekat bisa mendapatkan sehari paling sedikit 20 order, iya benar 20 order go food jarak dekat Tapi yang mirisnya dari 20 order tsb pendapatannya paling banyak 100 ribu ,diluar insetif dan tip pelanggan Bisa di bayangkan narik 20 trip tapi hasilnya tidak sesuai dengan capeknya T",1,4,1.10.0,2023-12-16 12:56:46,,,1.10.0
b160dbcf-9599-4d0d-a280-3c04e3df9bce,Alan Tan,https://play-lh.googleusercontent.com/a/ACg8ocI6TE7kvos2fU_JxE2zf6uPXzxvEJA8aqjKB59C5Sfy=mo,App is always lagging. One day must clear many times data to get booking,1,6,1.53.5,2023-12-16 12:28:24,,,1.53.5
3e97f18a-0087-472c-ba94-6124f510dd48,Jenar Maheswari Yuan,https://play-lh.googleusercontent.com/a-/ALV-UjUe7Wm_LWhUL9wjvBc5srgElzvo2GX_z02ooTbiqV3Z,Ok,5,0,,2023-12-16 10:33:14,,,
68759180-3bf8-438a-ac43-d7fb7e59de20,Bang Bejo,https://play-lh.googleusercontent.com/a-/ALV-UjVGS4NSMgK5Lr0lm6H6Q4wwk37wgac3uCERol6iHuu6F6c,Luar biasaa memang!! Ketika tarif naik mobil nyerempet tarif naik motor!! Dan lebih parahnya aplikasi dibombardir orderan dr jarak 3-10 Km tanpa henti. Antara programmernya tidur saking nikmatnya menikmati kringat driver... Merdeka!,1,5,1.53.5,2023-12-16 09:34:54,,,1.53.5
2f5836e3-e46b-4fb2-9c50-0cf7ecdde870,Gage Twins,https://play-lh.googleusercontent.com/a-/ALV-UjWFKuqbZA_JxtiV4valJ-8UKNBUjJ37a6fZpzEIqG7EqeI,Bad,1,2,1.53.5,2023-12-16 05:53:10,,,1.53.5
1c752894-cf34-47ef-b996-75f4fadd3349,Life On Film,https://play-lh.googleusercontent.com/a/ACg8ocK5jHdRnxrBi866EI0AuNyh50qnGbzXTWZuipwpFm-L=mo,Very BAD APPS!!!,1,2,1.53.5,2023-12-15 17:29:19,,,1.53.5
929282bc-1184-48b1-819e-7279603acc6f,andre bone,https://play-lh.googleusercontent.com/a/ACg8ocK-93YCgzVmg8f6r7hoH476f_kKdmpVcDG_1b6iXlWw=mo,Good application,5,0,1.53.5,2023-12-15 15:18:40,,,1.53.5
b0427193-6ff5-4873-8771-1062fecf88b7,Muhamad Fuad Febriansyah,https://play-lh.googleusercontent.com/a-/ALV-UjUgbwn39qg3QsjJUebZztdxsUdhiyvtr4UHLz2LgApSPg,Mantap,5,0,1.53.3,2023-12-15 13:51:00,,,1.53.3
04b088c3-3b4c-498b-a5b0-a5b5ec14d9ba,Udin Amad,https://play-lh.googleusercontent.com/a/ACg8ocJBmVnR-fo5yet-aFG80_tWyGnxt6csyaaYdekbJh4L=mo,Knp ga bisa updet Poto STNK gimna cara nya,3,0,1.53.5,2023-12-15 10:16:57,,,1.53.5
94dd3ec9-db70-403d-82e6-d2ccfa8c841b,Andri Gunawan,https://play-lh.googleusercontent.com/a-/ALV-UjUS-LibmQsX9qtbC14eCbuCijefHQCGUZxLes1ddPgZvQ,"Too much unnecessary updates, while the good features are missing and added yet",1,8,1.53.5,2023-12-15 09:51:06,,,1.53.5
4cb3f837-eae0-4753-b521-2108b6b1e04c,Agung Tri Anggoro,https://play-lh.googleusercontent.com/a/ACg8ocLwLnrHG-8GOilRIlwWL0YqzEHSi1sVc_E1X3o3vXTr=mo,"Apa apan ini aplikasi, sumpah aplikasi terburuk yg peenah saya ikuti......",1,8,1.53.5,2023-12-15 02:05:46,,,1.53.5
3d126efe-4b39-4c8a-a533-7a64a8cf06db,fredy_ d'firha,https://play-lh.googleusercontent.com/a-/ALV-UjWzG7PNOm5aIrYV-lgYli4yFSdpcAzbkjLVLbZv4g_ptQ,orderan teh seseut wae boss..kudu meli jaket anyar kitu meh d berean order..,3,7,1.53.5,2023-12-14 17:29:59,,,1.53.5
106d256f-6a6e-4847-a97c-c59b645b1aae,Hoi Grune,https://play-lh.googleusercontent.com/a/ACg8ocIvJLzUVzHBwY8Xx6zjitb2a64WBtLHTB1xkBoDh6qb=mo,Aplikasi tidak berkualitas sama sekali !!!,1,3,,2023-12-13 18:03:37,,,
01f3e162-9f1f-4104-9bd8-90c7a5eb8aa2,steyward christian,https://play-lh.googleusercontent.com/a-/ALV-UjU5qq81QYdb166cBmCOhdf9H_tBtn0Cm8oU6rh-2MqP7-I,Pembagian order tidak merata,1,3,1.53.3,2023-12-13 17:28:31,,,1.53.3
9adc16ab-9840-48ad-ada9-23d19b576bec,Febrian D'Gumanti,https://play-lh.googleusercontent.com/a/ACg8ocIqqrEyVaYNRPFGzAXmrBtCjKn9HC0mOodd8IfrtQKd=mo,Vermuknya terlalu sering .. bisa sampai 3 kali dalam sehari,2,3,1.53.3,2023-12-13 17:10:18,,,1.53.3
93544d17-1b34-4f39-86f2-b0c10afe6a11,Veen Nick,https://play-lh.googleusercontent.com/a/ACg8ocJxxnEFa1XUAkw4RcqhsvQWBEIGjoEcWs17MGhoei9p=mo,Tdk ada setting (pengaturan) bahasa kah? Aplikasi juga tdk mengikuti default bahasa handphone...,3,0,,2023-12-13 08:59:19,,,
5276074d-99c3-48ce-bc18-503d47a3c643,Idho Rap,https://play-lh.googleusercontent.com/a-/ALV-UjXFaw6Lp0rPjHqWJ9PVukTJSPztPv1vPuUDxHadvFdDcVI,"biasanya 19 atau 23 trip udah bisa 300rb, sekarang 27 trip aja belum tentu bisa dapetin 250rb .. gila bener potongannya jek jek, gak mikirin apa perawatan motor driver bagaimana? buta kah mata hati mu jek ðŸ¤¦ðŸ»â€â™‚ï¸",1,20,1.53.3,2023-12-12 18:49:16,,,1.53.3
65d75572-4585-41c4-b0e4-42902bb38dc8,Doni Kerjakerja,https://play-lh.googleusercontent.com/a/ACg8ocJoSgNPK1mpY63cvepUBQS3xQ9Cg_lPVWUiiAXuZBe3=mo,"Tolong orderannya disesuaikan untuk kota kecil seperti Kudus, Pati, Jepara jangan disamakan sistemnya kayak di kota besar kadang kita keluar pagi lebih pagi dari yang Laen tapi malah 1 hari full cuma dapet 2-5 order terimakasih ðŸ™",5,0,1.53.3,2023-12-12 12:51:08,,,1.53.3
75290af9-7f54-41e7-a953-69864164396d,Adi Suryadi,https://play-lh.googleusercontent.com/a/ACg8ocKj-WoFMe8p5OVZrR4Ik3VcCGe2-Kkz__tXqWyAxZAN=mo,"aplikasi lambat,bikin bingung driver dalam titik jemput, respon lambat,tapi kalo soal pemotongan apa pun cepat.",1,2,1.53.3,2023-12-12 11:14:46,,,1.53.3
85193f6e-96b1-4a1e-96fb-2a9a6ba3662d,aditya saputra,https://play-lh.googleusercontent.com/a/ACg8ocL6D7nJy-eQvFon-0-PxBocRsvz8mpY4Yc_8tWxvk9Q=mo,opsi autobid di akun gofood jarak dekat hilang sendiri dan tidak muncul lgðŸ‘ŽðŸ‘ŽðŸ‘ŽðŸ‘Ž,1,0,1.53.3,2023-12-12 05:06:12,,,1.53.3
69fcbbe9-278a-4b34-bd9d-48e7326e7c85,Jo Jamaludin,https://play-lh.googleusercontent.com/a-/ALV-UjVL4U2hcUsw5hZo7qiMqo_OduJkTaauj_7bLlmRQSfnVnc,"Aplikasi lemot, dan bloon.",1,10,1.53.3,2023-12-12 02:10:51,,,1.53.3
f65bc38e-4cfe-4f0b-89ba-20f8cf942674,benny honoris,https://play-lh.googleusercontent.com/a/ACg8ocJIyRdYgzX376wog0z1bTZkhTe8CLnCq5hv1JVxuvkP=mo,"Pengambilan Food jarak ke Resto 4 KM dan 3 KM di saat tidak hujan atau jumatan tetap ngebless. driver rugi bensin dan rugi waktu perjalanan. pengambilan jauh 4KM pengantaran pun tetap jauh 4KM Argo sama hitungan 4KM tidak ada lonjakan dimana hati nuranimu gojek. motor isi bensin bukan air. pengambilan jauh antar nya dekat atau kasih lonjakan itu baru bijak, lu mah enak jek dapat dari resto 33% dapat potongan driver 20%. driver harus tanggung kerusakan motor, taruhannya nyawa.",1,1,,2023-12-10 21:27:33,,,
86a7da9b-a9c6-46d5-bae2-8c705a40e68a,Moses Septvr,https://play-lh.googleusercontent.com/a-/ALV-UjX16v7io6SMYS5MsBMxex93a3UIod8cG5b3umr56mq4BtA,Tarif benerin,2,2,1.53.3,2023-12-09 20:39:47,,,1.53.3
4b017a6f-0316-4f03-8f09-f2dc0d4034c4,BUDI PRO BLEM,https://play-lh.googleusercontent.com/a-/ALV-UjUQaVKkkD5ClkHjRUXbW-bXRBlWw1W5JsqHFt145Q39I5J2,"Aplikasi lambat banget, masak verifikasi muka loadingnya berjam jam",1,1,1.53.5,2023-12-09 18:27:08,,,1.53.5
0b62f584-99cb-4799-9173-b10cab4c9767,Mampang Peralatan6,https://play-lh.googleusercontent.com/a/ACg8ocI0YFPuuwKwfUEQJYzsNYm-PnJpBL53PLgG7aNQCEp8=mo,Saya tidak bisa upload STNK Dan SKCK kenapa ya?,5,0,1.53.3,2023-12-09 12:26:07,,,1.53.3
2ad89abe-8a56-4e19-b87e-bd172645a771,Afif Futaki,https://play-lh.googleusercontent.com/a-/ALV-UjWrg7EIah3R8vdMCde6jc5jcK1nf27WvUym_6-T6P2xrBFk,Fix your map,1,1,1.53.3,2023-12-07 05:45:03,,,1.53.3
cfa7777e-4834-470a-9d14-940f2d93f459,Ahmad Samsudin Makmoer,https://play-lh.googleusercontent.com/a/ACg8ocLWI8v1krgeFIzPj1X3ZFxTX-in9Upiwe6hfjW248Dx=mo,Ok,5,2,,2023-12-06 15:25:04,,,
23e52696-8dd9-4378-8a94-fe8e6277ba76,Hendi Nurhendrayana,https://play-lh.googleusercontent.com/a/ACg8ocLYBHON9WGnU2KrPGqY0yZSoXiQtQC071jUgJe4Xb_9=mo,I can not update go partner app..please fix this,5,1,1.51.0,2023-12-06 09:36:16,,,1.51.0
0f7794bb-50be-40e1-872f-217ed1dffd7e,Bennard Setiawan,https://play-lh.googleusercontent.com/a-/ALV-UjUD5bZpZTLJUDns423ry-mbpZdpzGt9L9fcvBv7gnBcO9M,"Ganti kendaraan / nopol kendaraan, sdah minta bantuan (dan di syaratnya harus ada foto nopol kendaraan lama) wait a minute di ganti karena kendaraan sudah ga ada, tp hrus ada fotonya... Layaknya kalai ganti cukup surat2 kendaraan baru lengkap... Bukan mempersulit",1,1,,2023-12-04 22:05:10,,,
3504884f-65a4-42a3-97f3-b3845d760ffa,nodirkii,https://play-lh.googleusercontent.com/a/ACg8ocJofEziqJbJjXRfgaobtQoy9nEBNcMoNbji0lnhG6Bb=mo,Pembagian orderan yg jauh dari kata manusiawi. Potongan lebih dari 20%. Tidak ada keberkahan untuk orang orang kantor gojek.,1,4,,2023-12-03 16:45:27,,,
58bf1244-eb13-4707-8d64-a457467daae6,Dina Israwati,https://play-lh.googleusercontent.com/a-/ALV-UjU04uJKzlc0m-kLlWILcpQEGYsMFSnNK_5H7chgmNUXow,"anyep terus, driver rajin ngga pernah cancel dan lewatin tiba2 2 minggu budeg, sehari dapat 3 order, on 12 jam, kalah sama driver aceng",1,4,1.52.3,2023-12-03 08:19:25,,,1.52.3
833300eb-4b5e-4645-8327-cebc4ade4e0d,Erik veroland,https://play-lh.googleusercontent.com/a-/ALV-UjUrO72GdrX5h-N_SsHsSDw8wtHbCZn7VLgoKWca4Y7cJ8M,Update trus tapi orderannya seret...,2,2,1.51.5,2023-12-02 09:23:49,,,1.51.5
54b3080a-5206-4f5c-abaa-810107a65da8,Muharmy Kurniawan,https://play-lh.googleusercontent.com/a-/ALV-UjVqkHwohnEIdFpmiEaigqi_cmXBamZ9CMY9BLfqP5Tal2g,ordetan gabungan tolong di perbaiki lagi sistem ongkirnya. masa jauh dekat untuk orederan gabungan ke dua tetap 2rb dapatnya,1,1,1.51.5,2023-12-01 22:56:51,,,1.51.5
3669466d-f8f5-4813-97d1-a867c4d72dea,Rikki,https://play-lh.googleusercontent.com/a-/ALV-UjWwk3KzXGI-O4jC1zNfWMyyBxrImr8PW5uxYUmYowAHSgM,ubah tombol terima pesanan ke model geser pekog,1,3,1.51.5,2023-12-01 20:31:11,,,1.51.5
4cb64c33-cbe0-4e44-a5c8-633f5fef1b2e,Sigit Pria,https://play-lh.googleusercontent.com/a-/ALV-UjUYEfKUPMVIB2BvMA8_uWmmyCMfkz7lQbidZSUPXjfCS9ZZ,Kelamaan review,2,3,1.52.3,2023-12-01 15:53:21,,,1.52.3
390dfc4b-ff86-4bef-825e-9c40f6f5557d,Surya Dinata,https://play-lh.googleusercontent.com/a-/ALV-UjX9c8okhB-uoeejFhSBICUMQJhlnLTxhG68fI0iY-x-WT8,It's hard to get an order,1,3,1.52.3,2023-12-01 09:41:27,,,1.52.3
021fd7fc-83ed-4627-8fc9-6800fb992fc2,Taxi Driver,https://play-lh.googleusercontent.com/a-/ALV-UjWQXVScjyQhTTOL8MEnWg-mxIqb__5Q-QUUb7NT0GBDdVk,Tampilan dan fungsi app nya bagus tapi sistem koorporatenya nya memiskinkan,2,2,1.52.3,2023-12-01 03:03:59,,,1.52.3
770ea15b-9d18-48f4-8192-f9ab7ffc0487,Dany Sugh,https://play-lh.googleusercontent.com/a-/ALV-UjWUo_QGUmtSV1KfU59ZGLAI9-m2HsaAevZFB5BiVQALXpU,VERIFIKASI DOANG TIDAK DI AKTIFKAN.,1,2,1.15.2,2023-11-30 21:37:22,,,1.15.2
e5046c6a-447b-4c01-924b-2cd8d5b1ca50,alidwi cahyono,https://play-lh.googleusercontent.com/a/ACg8ocKwxcEg0fuN0GQapOg1KysuVM5QhgRxeD-w6-AAApH_=mo,Fake route,1,1,1.46.0,2023-11-30 20:35:03,,,1.46.0
59748c90-f4f8-43b3-8e23-95ead8c7c1e9,stillsedeng81,https://play-lh.googleusercontent.com/a-/ALV-UjUwFUZJ-92uDacs0yhZhGlm4dle3QQy4OlCMYEsfJ7jLqs,dora seng nyekel tambah abot,1,5,1.52.3,2023-11-30 13:32:06,,,1.52.3
bf4243d8-18f2-4802-a294-397cb4acedf8,granita go,https://play-lh.googleusercontent.com/a-/ALV-UjXZrbolmaVSqy-QfRLbQOkomQfULw19PTNeACKwqlzbUw,"Loading takes longer than previous versions, 1st pick up too far from starting point, the rules and policy is likes we are an employee rather than partnership. The only positive thing is that there's no price cutting for every bid.",2,19,1.51.5,2023-11-29 01:23:33,,,1.51.5
1edb7be5-4b2b-481a-99f9-7df65441cdc8,Ricky Arya Saputra,https://play-lh.googleusercontent.com/a-/ALV-UjUSnUDbVdNmUKcQaGI2hdesF4rzQrrLLG4IZjh9x2WpxS8,"Gimana contoh orderan Gofood gabungan? - Dapet orderan dari 1 resto dan 2 alamat berbeda namun searah dan BERDEKATAN SEKALI - Pembayaran cust pertama saya terima bersih Â±25.000 dan pembayaran cust kedua saya terima bersih cuma nambah 2.500 doang Aplikator dzolim yang cuma mementingkan kekayaan elu doang Segala bikin fitur orderan gabungan dengan dalih ""efisien waktu dan tenaga"" Cuih! Bilang aja biar pendapatan dan potongan komisi lebih banyak malah ke elu pada Makan noh duit kufur nikmat!",1,5,,2023-11-27 23:44:12,,,
d809b35d-774c-43c3-a206-2ad7f4de6eee,Dani Yudistira,https://play-lh.googleusercontent.com/a-/ALV-UjUo2QGrzWtOoZaBwRDxZoVqeUzQE-EDKr2JYMoBnHzyveM,Skrang Susah skali mendaftar,1,1,1.51.5,2023-11-27 12:02:55,,,1.51.5
a88f4bf0-e0ac-4325-b25a-eade17d75810,muhammad nassirr,https://play-lh.googleusercontent.com/a/ACg8ocJnT7qxuarspe80R-R1jUBm06lVph3DoLYyKUkbJWED=mo,Huawahahahahhahahaaaaa wkwkwkwkkwkwkwkw,4,4,1.51.5,2023-11-27 10:46:15,,,1.51.5
fe6893ec-1f03-4d1a-8add-0ea3a12b77a8,eRK8,https://play-lh.googleusercontent.com/a-/ALV-UjULtuRbhxWQEBn6HMEPlm5wwhbVNM4XihafCfpGP4RML8M,Sering amat ya updatenya buset dah...,2,3,1.52.3,2023-11-26 17:59:18,,,1.52.3
e6b45e6b-55ea-4a0e-b340-b0668c4a9961,Niko Esprecielo,https://play-lh.googleusercontent.com/a/ACg8ocIsK_bLXpq8CzOKBu0hwTt3CSHciroXDFulnhJcttSQ=mo,"Update aja trs, orderan anyep dianyepin malah,ga guna bngt bneran setiap 1 minggu update trs",1,5,1.51.5,2023-11-24 17:47:05,,,1.51.5
2ec033ec-4500-490e-9e8c-611550f89e1b,Yanu Prasetyo,https://play-lh.googleusercontent.com/a/ACg8ocLZybtA_Aur5fJX8GdUIj_DfeCzyI7n_IO21PqugarE=mo,Selama kinerja IT masih seperti ini. Akan selalu bintang 1.,1,12,1.52.3,2023-11-24 12:35:27,,,1.52.3
8256e2bc-9545-49a6-bfdf-dd468ab26144,Hasan Sadikin,https://play-lh.googleusercontent.com/a-/ALV-UjVgzLK18qdBtW9JWuucBYH3tGJxVVMYek8sWY4k6iKCYg,Driver nya tolong kondisikan dong dijalanan arogan banget. Perusahaan besar masa ga punya SOP buat mitra nya,1,1,,2023-11-23 22:05:18,,,
f91d91e8-8a3c-44ed-8b8c-c2fd55d46e9d,Agoes Baz,https://play-lh.googleusercontent.com/a/ACg8ocKsNdClc0CL4wWwS79zh0DWh_oIrD45lPonpEXu5sbW=mo,dari awal gojek dah ampir 7 tahun ngetrip dgn mobil yg sama. tentunya plat pun sama di fitnah penumpang dengan rating jelek dan dikomen plat tidak sesuai. langsung budeq acount sy. seharusnya pihak gojek cek apa benar yg di tuduhkan penumpang bener gak jgn langsung acount kita di lock. yg fair doong kita driver kerja jujur hargainlah usaha kita.,1,1,1.51.5,2023-11-23 11:45:21,,,1.51.5
429200ec-b7d8-4437-801d-05453d6fbe0a,Aprianti Aprianti,https://play-lh.googleusercontent.com/a/ACg8ocL5bXgZder7Tb-SAAALd86bCcj4mV01sfg90EnJxW_h=mo,bagaimana cara melaporkan gojek yang bandel asal kirim paket? hotline gojek tidak bisa dihubungi,1,0,,2023-11-22 20:26:31,,,
62269903-9036-427a-b7b8-e9cf0f6441ac,Kapang Pursonoadji P,https://play-lh.googleusercontent.com/a-/ALV-UjWfqp__w8ZGNeOr7OYp1B9Ye57U3pI5KlQimptEpISmgiM,"Saran: add fitur, kode O.T.P login di kirim ke whatsapp dan e-mail (untuk alternatif saja). Terima kasih.",4,1,,2023-11-22 12:59:53,,,
1340825f-1481-4fd6-a421-9769786fc0b9,Ari Setiawan,https://play-lh.googleusercontent.com/a/ACg8ocKFvm846yARyib31EYMC0ibKF6sMEwijRXGvxeJk4Sl=mo,"Wd malam lama masuknya, padahal driver bituh,",1,2,,2023-11-22 02:27:45,,,
acbfecdc-a4d3-494b-a56f-7f8ab83ed29d,Kusnadi Jaya,https://play-lh.googleusercontent.com/a/ACg8ocLLT6N5cFFrB7bVbzkSst49BrxgKxlsIo3lYtREOEcy=mo,Bagus membantu agar bisa ada uang tambahan di dapat sebagai Mitra gojek,5,0,1.34.1,2023-11-21 23:54:02,,,1.34.1
557614ea-b61d-4ab9-b174-230fcfc93fe7,Hady Susanto,https://play-lh.googleusercontent.com/a/ACg8ocIHAfuCq2NLh3oYs5rUP7P1JgoTG12N-zsxd5RxE4eH=mo,"today 21 November 2023, I have finished 8 order completely. so I transferred from the wallet to my bank. my wallet is empty now but I didn't receive any money in my bank account. I don't know how to get to app help or CS to share my experience",1,9,1.51.5,2023-11-21 18:26:39,,,1.51.5
f568f28f-1159-41d3-9823-68c9fef32114,rahayu nurhasanah,https://play-lh.googleusercontent.com/a-/ALV-UjWuZO-AnFmts1FP_Y_JUId6K6PDIkoVwBaRjuDqArYGKVs,"Akun goceng kebijakan tolol, maruk, kapitalis, system tolol driver pindahan gofood ke goride pada digacorin tiba2, kita yg udh lama goride di gagu in, TOLOL",1,3,1.51.5,2023-11-21 13:10:00,,,1.51.5
e5d74db7-5404-4312-9625-d10a27da2675,Chan Peng,https://play-lh.googleusercontent.com/a/ACg8ocK5AntBukG5ty-KkEUHLC0sF_qX9pkgrr2fWqqZTYJs=mo,Really lousy IT cannot resolve problem.,1,1,,2023-11-20 19:41:19,,,
55f1dc00-4e15-4c4d-90ad-1ef6809814e7,Aan Rendy Ariyanto,https://play-lh.googleusercontent.com/a-/ALV-UjUII0tNid_YPCcRq8kZzqUvMNOpv8EmjGW1vyRVSdLrRCY,Untuk pengalaman sangat baik dan tanpa kendala. Di jika saja ada pengaturan Mode Gelap atau Dark Mode pasti akan sangat bagus.,5,0,1.51.5,2023-11-20 19:36:05,,,1.51.5
46a664c3-4328-41dd-acd8-b0788f15c5dd,Revanz,https://play-lh.googleusercontent.com/a/ACg8ocKUOANIuNBcY_kVwAuvXBwaeMQgp6DyYMKYMgS6kb28=mo,Mantapp,5,0,,2023-11-19 12:47:26,,,
a848ae02-258e-4afb-acc8-23c6f5a18880,Dedi oke,https://play-lh.googleusercontent.com/a-/ALV-UjViFl9QvuBkYsWAVLryj0n1_ZIzcSbffqybics5fz0E1g,Jl nangka menuju aeon mall tg barat di tutup sementara krn ada proyek penggalian jalan. Mohon orderan rute dirubah krn kalau dpt di aeon mall yg mau ke arah antam atau pasar rebo muternya jauhh ke arah puteran lenteng agung tapal kuda serta argo disesuaikan.mohon agar orderan tidak diarahkan lawan arus ke arah antam atau pasar rebo krn sy dpt di aplikasi gojek petanya lawan arus dan argopun murah tp melanggar lalulintas.INI merugikan driver serta melanggar lalulintas .sekian terimakasih,3,19,1.51.5,2023-11-18 12:42:19,,,1.51.5
3d7dfb9f-bb40-4de9-9c6d-97d36feb359f,teja budiman,https://play-lh.googleusercontent.com/a/ACg8ocKaPsVjg_o-aO6rNxpg9Si4fFFrCkhfaUvPvIC374U99A=mo,Buruk,1,4,1.6.0,2023-11-17 00:38:08,,,1.6.0
6a7c05ab-4991-4f36-b738-2ab7f29cc651,Gaung Satrio,https://play-lh.googleusercontent.com/a-/ALV-UjWzSIVXjI6l4w_Pf1aQ-3feKpGqwdGhJ_pOO7lHVkiMl_Q,"Bikin tingkatan2 peraturan baru lo gojek, makin nyiksa, sering kali order masuk pelanggan gk ada di tempat kami gk bisa cancel sesuai keadaan sebenarnya. Banyak tingkah kalian semoga bangkrut.",1,11,1.51.0,2023-11-16 22:30:17,,,1.51.0
0d3c593b-867e-4f5a-9eef-bbabec28d8fa,iyuz gojek,https://play-lh.googleusercontent.com/a-/ALV-UjVUMVZFATtOuEHZKe06wqnf_AAZeeSTt6Q4xB06_GltpA,"Ga bisa diupdate, error terus..map selalu lewat jalan yg sudah tidak bisa dilewati lagi, kalau mau buat laporan yg berhubungan sama rute ribet banget prosesnya org ITnya gojek kerjanya aan sih",1,1,,2023-11-16 18:42:57,,,
528d42a6-afec-40da-ab15-54b5ab3b25a4,Yusuf Sade,https://play-lh.googleusercontent.com/a-/ALV-UjV4hnltfX08MMgCST1Fa_tbwvasNZXtFvR0hU2J2OUtCtM,TopðŸ‘,5,0,1.51.2,2023-11-15 17:51:56,,,1.51.2
20c96b23-7d92-472b-83ba-b3377351be43,Syach Yuanri (Eric),https://play-lh.googleusercontent.com/a-/ALV-UjU936UIqHf94JZswgCFEkV_3LMIwRKtsofNpkSA25h9whA,"always gave me just one order per day, even though I started to online so early in the morning ðŸ‘ŽðŸ¼ðŸ–•ðŸ¼ðŸ‘ŽðŸ¼",1,5,1.51.2,2023-11-15 16:35:34,,,1.51.2
c60f7a4a-aa9e-4d64-b45b-edb4db88c5c4,Muhammad Arif,https://play-lh.googleusercontent.com/a/ACg8ocJfaaQy7R9_70_ksCIelemFHAmRfvPmjQeczjpoFwIe=mo,Tidak direkomendasikan untuk fokus,1,7,1.51.2,2023-11-15 09:54:59,,,1.51.2
80f5873f-aae6-49f3-b2d1-506d4844f870,Harpiest Rudecaesar,https://play-lh.googleusercontent.com/a-/ALV-UjUkFURRJenfT10D3s7sEKkbwD32gG0VSb7YZROR20uqxbs,"Gue belom pernah punya akun gojek, baru 'mau daftar' tp ga bisa krn ga buka pendaftaran, malah d bilang gue udh pernah d PM,,, yg koplak siapa sih?",1,1,1.47.0,2023-11-14 19:06:55,,,1.47.0
de51ffd5-0b33-4bc1-9dbd-0741dbaaf622,Adi Irawan,https://play-lh.googleusercontent.com/a/ACg8ocIYdgX4_XBAQoVTjmLVxRMyVtdEAOudzX_3cjz9EK3S=mo,Order distribution is unfair and servers often have problems. IT people are too amateur like internet cafe technicians.,1,1,,2023-11-13 19:56:47,,,
9ee340b8-f301-4682-82f2-6ac396003a4d,Rahadian Tito Triaji,https://play-lh.googleusercontent.com/a/ACg8ocIWJOgvm6x3OEgKAnEl0QqWN-HFnPFE3zb3b3dZQZxn=mo,//No bugs no worries// Are you kidding me? No. You are kidding us.,3,8,1.51.2,2023-11-13 06:49:22,,,1.51.2
8a124310-6c03-4939-a899-1220f96d08e3,wahyu rina,https://play-lh.googleusercontent.com/a/ACg8ocKvO3X-SlTjdhPYhza_9KxI75YNb1ZXPqJJkexsJsSw=mo,Double order menyengsarakan driver dan customer Driver cuma dibayar 2rb untuk order kedua Dan system searah nyatanya tidak pas Belum lagi orderan kedua bisa masuk walaupun orderan pertama sudah berjalan lebih dari 15 menit otomatis orderan pertama harus menunggu orderan kedua selesai baru bisa diantarkan Hapuskan sistem double order,1,1,1.50.1,2023-11-12 13:26:02,,,1.50.1
eb1446a8-28c4-4649-b48d-d3224029d06c,Robby Suhadi,https://play-lh.googleusercontent.com/a/ACg8ocIJUJ2p7RDs143E1BuBpq24PU3XQ7pMPP9cQ1JmfzlE=mo,"Budakin mitra,tarif angkot,bukan tarif taksi,jmpt jauh n macet,komisi gede di kantor,di mitra cm dpt uang cape",1,2,1.39.1,2023-11-10 13:05:22,,,1.39.1
f2bfd258-2b63-4a60-9fac-7348eed7d483,Rivaldo X,https://play-lh.googleusercontent.com/a-/ALV-UjWZ6nc40quRxei1oal6uR7AuZ7JHJKcf6SM-QsTYhZ5h5s,CUSTOMER CARE NYA LAMBAT DAN BODOH! SUDAH DILAPORKAN BERAPA KALI KALAU ORDERAN FIKTIF MALAH LAMA DITANGGAPI! SANGAT MERUGIKAN DRIVER!,1,5,1.51.2,2023-11-10 09:11:12,,,1.51.2
c92e8ac8-f70a-42df-a69a-261a6f7d5159,Emil Psionics,https://play-lh.googleusercontent.com/a-/ALV-UjV-rOY7BMbmHtG4egTLspHmb5WdJgSkfpGnKiTBk2_lLY0,"V.1.10.0 Sering freeze, harus tutup app lalu buka lagi, terutama ketika ada orderan masuk. Boros Battre. Agak nge-lag. *Redmi Note 9 Pro*",3,4,1.51.2,2023-11-10 08:19:25,,,1.51.2
00fcc207-2ff6-4b12-a927-fc700bab41c9,Jilan Rifatul Adillah,https://play-lh.googleusercontent.com/a-/ALV-UjXCbpG_4oSPP60bjuMCNaajbvZZ3tqZaMfg9x1iZWHyfsc,Can't register. It says full ðŸ˜’,1,1,1.51.2,2023-11-10 01:54:26,,,1.51.2
9fcb3731-8348-4ade-9e03-a3f0538e7d22,robih fauzi.an.7.c,https://play-lh.googleusercontent.com/a-/ALV-UjVzdDUGZiY8_vzQuCPDQIgHwX7J9GTbeCdhULD-riW0,"Yang gacor mah gacor, yg anyep mah anyep. Ah sudahlah. Moga dapat kerjaan lain.",1,2,,2023-11-09 16:08:31,,,
