reviewId,userName,userImage,content,score,thumbsUpCount,reviewCreatedVersion,at,replyContent,repliedAt,appVersion
72955390-9b17-4696-a0f6-b897a1104165,Suhardi wibowo,https://play-lh.googleusercontent.com/a-/ALV-UjWoEorcYPN8fWqSjFY-u8aXs1-heIUC_Xnoh8jK6ikPuP8,"Fitur menu Penyerahan Dokumen GOPARTNER DRIVER selalu bernotifikasi :"" TIDAK ADA KONEKSI INTERNET..!""notifikasi tentang tatib update Dokumen masuknya pake Apa, kemudian order order terselesaikan yang masukpun dengan MENGGUNAKAN KONEKSI APA..?! RIDHO ""ETHICS"" UTAK ATIK..! (It's so) ""sorii yee..sorii yee ??!""",1,1,1.55.0,2024-02-03 02:17:12,,,1.55.0
99e8565a-6b97-4215-a8c1-3aef6eda7ce3,Mbuh Lah,https://play-lh.googleusercontent.com/a/ACg8ocJhtTe0DG6HGdI-bNP5nJOG4J83IRzjEOS7xMBDC-q-=mo,"Gojek semakin nyungsep sepi orderan, sdh nggak bisa di andalkan para driver. Mundur perlahan",1,2,1.55.0,2024-02-02 22:10:11,,,1.55.0
527c6330-6bc9-4746-ae1b-372912b84eff,Brahmana Lubis,https://play-lh.googleusercontent.com/a-/ALV-UjXcGaoIaEmIbF33AnGL6f9MJkyMxKNiSQddrSd5CgMM2sI,Setelah update terakhir jni kok berat banget cari posisi driver? Verifikasi muka juga lambat? Tolong dong.. Sementara aku kasih bintang 3 dulu,3,0,1.55.0,2024-02-02 10:07:03,,,1.55.0
7607377b-b75f-4960-9c66-adbf728672cb,Giggs Black,https://play-lh.googleusercontent.com/a-/ALV-UjUAbXmpKOKWU8flXbpVMNWkzz-icAVGmGrETaXhL5Y9380,You aplicator rule to much for a partnership only.,1,1,1.55.0,2024-02-01 19:06:16,,,1.55.0
eebc09b5-b877-4781-927c-c918484e8c0d,Andi Hendrian,https://play-lh.googleusercontent.com/a-/ALV-UjVK9PuIDJiPVj2IiVJ_6nrTnYyFzj1GKLb4hyXihUiEd8O4,"Para ahli IT Software Gojek yang pintar, gunakanlah ilmu ada untuk kebaikan orang banyak. Jangan hanya pintar membohongii kami para driver yang anda anggap bodoh ini. Lihatlah ke lapangan, lihat kenyataan yang ada. Pembagian order sungguh sangat tidak adil. Banyak dari kami sampai berhutang hanya untuk membeli beras untuk makan keluarga, banyak yang hilang harapannya untuk membayar sekolah anak anaknya. Update hanyalah membuat pembagian order semakin tidak adil.",1,4,1.55.0,2024-01-31 07:15:00,,,1.55.0
76686fb3-26e5-4771-b56c-1aad64234758,GUE Papipacinkho,https://play-lh.googleusercontent.com/a-/ALV-UjWeEvqMzWacNgHLxdAol1KiMrX4rZZnBhB5g5UNvQn62oA,"Dari 300ribu/hari, lu turunin ke 250ribu dan dalam 2 bulan elu bekuin akun gue, cuma elu kasih argo 10ribu sehari cuma dapet 20ribu. Potongan elu udah 35% sendiri. Gua ngga pernah milih orderan, yang masuk gua sikat. Tapi sekarang akun gua berasa akun blokir. Ngga pernah disentuh walau orderan depan mata, yang dapet orang laen. Gua punya tanggungan keluarga dirumah. Hari ini gua ga bisa nuntut elu didunia, tapi diakhirat gua minta keadilan dari sistem elu.",1,1,1.55.0,2024-01-30 20:02:11,,,1.55.0
49e9c062-c467-4d7c-bf7b-7507f2e90856,Dhany Ramdhany,https://play-lh.googleusercontent.com/a-/ALV-UjWctKvka6JsPOuZMBd0lBCWO0fUEE_-T9lWY_aMyOrz0fY,"Saya tetep kasih bintang 1, karena setelah UpDate GoPartner saya, ternyata peraturan berhubungan TopUp saldonya itu dibuat ribet, krn harus ada aplikasi GoPay nya, lah ngapain coba! Bagi saya TIDAK PENTING! Ngapain peraturan dirubah, saya tdk masalah dgn sistem lama, udah skemanya dibikin susah eh tambah ini dibuat ribet, memang otak tim kalian ribet.",1,3,1.55.0,2024-01-30 17:47:41,,,1.55.0
f6deccf8-5332-4033-a9fb-d7acb6b72ef3,budi satyanto,https://play-lh.googleusercontent.com/a-/ALV-UjU4ULKAx-ozD7zoB1RcSIEaXBm9BHp-3Hd_XJhwwrznu-Y,Mana ini orderannya?,1,1,1.2.2,2024-01-30 16:43:06,,,1.2.2
b06ff480-3f11-4c62-9370-1bb90f556ea5,Ibrahim sholeh Sholeh,https://play-lh.googleusercontent.com/a-/ALV-UjUzPTb6JOx2PM3-8YxaZ8ADhz2cKEsb7EB6cRBKv1AYYg,Boros batrei,1,4,1.17.1,2024-01-30 11:37:51,,,1.17.1
2a5f5bc7-3fd6-4bd8-a3fa-cb4ba3d088a2,fanzi setiawan,https://play-lh.googleusercontent.com/a-/ALV-UjWxEAznN__wZ7-tIAYmQsce7PnEXZpIs_EDLQTZOaEnmcs,Thanks udah dengerin keluhan,5,3,1.54.1,2024-01-29 22:12:44,,,1.54.1
62872b40-8052-417a-af8a-cbdef84849e1,Calvin Hobbes,https://play-lh.googleusercontent.com/a/ACg8ocJnCObs5OL_eAn3R-v7ucXVKN7fsJUuextDEy9Cq2T2=mo,Please don't drive for Gojek!!! Gojek does not compensate me with any cancellation fee after so many of their customers cancelled the moment I arrived at the pick up location and after driving for 7-8 minutes!!! Why does Gojek allow the customers to abuse the driver like this??? Our time and petrol is very expensive!!!,1,12,1.54.1,2024-01-29 20:47:29,,,1.54.1
f1270a51-b46a-4649-84d6-48483b9fcb39,INFINIX HÃ“T 8,https://play-lh.googleusercontent.com/a/ACg8ocJJ1meNolfsjtMcxEd68QOPWd2Goi7jS-ByqAHgFd8Q=mo,BAD APK...,1,2,1.50.1,2024-01-29 10:33:13,,,1.50.1
59dd53ea-0ae5-47fc-89fe-78f6662b7d65,Doni H,https://play-lh.googleusercontent.com/a-/ALV-UjVk5juStZzjtZgYxqpYCrRAihw-o6FhErfUOWQ2aiV80Rk,"tolonglah di peringan, masa bisa 84MB, tingkat akurasi terlalu lemah, bahkan sering dapat rute jemput diatas 2km, dan satu lagi google maps yg akurat, cuma 9.88.2, 10.55.0, 11.19.2 dan 11.22.2, sering diupdate malah jarang dapat orderan, dah gitu pakai aplikasi GPS Up, baru ada. yg dulu pas tahun 2017 itu paling bagus malah target level malah kurang adil, masa dari 7500 pembagiannya jomplang banget, seharusnya adil, misal perak 2500, gold 5000 dan baru platinum 7500",1,5,1.55.0,2024-01-28 12:57:36,,,1.55.0
eddec058-14c1-46e6-a58a-41ba252b7d17,A. Gustha,https://play-lh.googleusercontent.com/a-/ALV-UjUtsP1S22bwck5VJdkX_FfzDBGfCGEaYAupBb1O8zv8JRas,Battery draining so fast !!,1,2,1.54.1,2024-01-28 08:34:05,,,1.54.1
64ad1645-7638-4e45-ad18-537dbbea7dca,Initialv,https://play-lh.googleusercontent.com/a/ACg8ocJMTAPMztG2VEchO6wtog02B7RuPDEyMyQYQFtYOmK51Q=mo,"Karya yg sungguh mengagumkan , salut saya sama anda sistem kacau argo murah bonus dikit lonjakan di hapus , ada goceng luaaaar biasaaaah mantap teruskan jek",1,4,1.54.1,2024-01-27 13:27:39,,,1.54.1
59a2fba0-7d3c-4e84-a6f5-a1d4c0796187,Andi Fathonah,https://play-lh.googleusercontent.com/a/ACg8ocLmDLGQ6IuW8xhOzq4osvaFeLWatEblLjTLP1NzSRJA=mo,crott,5,0,,2024-01-27 10:58:27,,,
07133567-4ab5-46d8-a3fe-af062ef39a86,Teddi Pronayuda,https://play-lh.googleusercontent.com/a-/ALV-UjWoUi12FvOpi09oOZ5LRZ15KTKGPG8tGTLwUV6J7mwtFQ,Daftar dari akhir taun 2022 sampe sekarang cuma di tahap lolos verifikasi. Trus buat apa diadain online registration klo emang ga niat buka lowongan driver,1,1,,2024-01-26 12:04:01,,,
cd450557-f6f9-4b16-8c5b-0585050db8ee,Setan Kampret,https://play-lh.googleusercontent.com/a-/ALV-UjWaZ_VrUOgio8ot2246VmXB3pNWpem70dEDGq-LhM-aggg,"Makin tidak bisa di andalkan, pembagian orderan tidak merata. Masa seharian cuma dikasih 1 orderan, sedangkan driver lain bisa dampai 15 orderan",1,3,1.54.1,2024-01-25 22:36:18,,,1.54.1
e2aa2b1b-ebe9-4c6f-aa18-29f2a2d22a6f,Simon Veri Sukoco,https://play-lh.googleusercontent.com/a-/ALV-UjWMyzj_z8ggH-2iA3BR_efHlDaN07g64IpzR5VIfiC6ras,"Aplikasi driver paling buruk dibanding kompetitor yg lain, tidak ada kejelasan tentang pembagian order, sekalipun sudah di level tertinggi bisa langsung anyep tanpa sebab, untuk yg punya aplikasi driver lain, lebih baik tinggalkan gojek, bener2 aplikasi sampah",1,3,1.54.1,2024-01-25 20:15:31,,,1.54.1
d0539350-dce0-4da1-bab9-c75c4f31e8d6,ahm,https://play-lh.googleusercontent.com/a-/ALV-UjXW8Kxd5rSAi6hY3bTUqBp1ifrVUp2O5Po4PqTj1GRlf2Y,"I have tried for so many times to propose to be the driver, and been waiting for so long timr but my driver proposal / application only verified, haven't been approved yet. I wonder why gojek not approve my application",1,1,1.54.1,2024-01-24 18:10:23,,,1.54.1
03eb92ef-3046-41ff-b084-b0d809f5850d,Rico Josep,https://play-lh.googleusercontent.com/a-/ALV-UjVHuCj7bMDE70CDDsEFW1lg0x5bKpMCFLUvdTd3CDdC8Q,"Makin lama makin hancur ini sistem.., fungsi tujuan searah ga beres, arahin kemana dapatnya kemana (berlawanan)..ðŸ¤¦â€â™‚ï¸ðŸ¤¦â€â™‚ï¸",2,2,1.54.1,2024-01-24 17:43:37,,,1.54.1
b7157587-c093-47a4-a73e-893a1a48146a,Nadia Nisa ayu,https://play-lh.googleusercontent.com/a-/ALV-UjX130bVXshibrF3t3cyiZfJjvjuRtY5u_sVHNX9o8g2RvU,"aplikasi apaan ini, aplikasi yg gak bermutu, slalu membela customer tanpa mementingkan drivernya yg jelas2 jd ujung tombak perusahaan, tanpa kami para driver kalian smua itu GAK ADA APAÂ²NYA...!!!",1,2,,2024-01-24 13:24:39,,,
04db00d6-6574-46f1-8588-4c0c4c676aae,Deddy R. Sanjaya,https://play-lh.googleusercontent.com/a-/ALV-UjUsMd1ITuJF8JPlbEQiMF8FWB5mG3M5NQ2fuDzCx5mfQAI,peta ngawur,1,5,1.54.1,2024-01-23 17:44:55,,,1.54.1
c447bb56-b0d9-4049-8404-a4033ea7755d,Sebastian Gian,https://play-lh.googleusercontent.com/a-/ALV-UjU7Bn4I4HWENTDvhuXuy5aR0QiTEfB1qrhYiXjEgUWwr1Q,"Tolong aplikasi sudah simpel gk ribet banget malah jadi kacau balau karena perubahan sistem Wd dan Saldo dompet, mang sistem yang sebelumnya kenapa si? Ribet kah? Bosenin kah? Pendapatan masuknya ke gopay? Yang bener aja! Saldo dompet dan Gopay tolong jangan disamakan alias dipisah!!! jangan dijadikan satu! dan lebih parahnya lagi harus beralih ke aplikasi gopay untuk transfer ke bank! Asli tambah ribet banget, jelasÂ² yang sebelumnya sudah bagus banget gk usah di utak-atik! Payah ini aplikasi!",1,5,1.54.1,2024-01-23 04:55:15,,,1.54.1
c22296d1-7605-4e5a-8fb2-54a110fafcc5,Nugraha Anggadi,https://play-lh.googleusercontent.com/a/ACg8ocIoiIiUeKBGgFtrHhfcZybogRpUtUjqQ9mRIHpq5lUT=mo,"Dari tahun 2019 daftar sempet ada panggilan ke kantor Gojek, cuma sebatas isi di kertas hvs data dan sampe sekarang belum ada panggilan, kalah sama yang lewat jalur belakang, padahal pengen banget jadi mitra gojek",5,1,1.54.1,2024-01-22 12:10:53,,,1.54.1
5eb95ec7-76e5-4336-af22-a0b496b70153,Bumi Menggala,https://play-lh.googleusercontent.com/a-/ALV-UjWuk9EjCX3AKITZQGZk0G-3AxLe6NZTPUjETYQcpfiH7mQ,"Vermuknya lelet, sudah jalan malah baru minta vermuk",4,18,1.54.1,2024-01-22 08:41:42,,,1.54.1
08aa64fe-bd6d-4e99-a374-c01302715178,Ahmad Nur Muthayyib,https://play-lh.googleusercontent.com/a-/ALV-UjXXjXGYOBd14r_YwknbwaIhCiLRP61v5Dd5kykll2IIRc8,Makin aneh aja sistemnya,1,5,1.54.1,2024-01-22 06:16:48,,,1.54.1
eaef8b92-f6c1-401e-b576-f6efd4ec8fdd,Pakindo Family,https://play-lh.googleusercontent.com/a-/ALV-UjW5-LgtV_A-sOrQ3WO6mcjwKJbDHGG0X6iSCTbLKKB84Do,Gopay ga bisa tranfer juga slow,1,0,,2024-01-21 22:28:12,,,
ccc174df-6d36-4ea8-9056-6d4f9299ef85,Travellink Agent,https://play-lh.googleusercontent.com/a-/ALV-UjUEMXnKsaLC8I0otNdVaQHwvtG__wwmV4k4axeEQIvNFnE,"Tarif Gocar ngaco banget, titik jemput jauh banget, driver terpaksa jalanin orderan sampah!!!",1,3,1.54.1,2024-01-21 22:08:24,,,1.54.1
595c8808-1ac1-40dc-9de4-ff87340ba6a3,Radika,https://play-lh.googleusercontent.com/a/ACg8ocLRi0OL8fq6KnYLTUjMRbzCNIJeIP7hgCwo0xeqNsQksA=mo,Balikin withdraw ke gopay supaya memudahkan driver thx,1,0,1.54.1,2024-01-21 17:46:41,,,1.54.1
13f4e53a-1732-4aca-8547-cb4e50150493,NoLife Guy,https://play-lh.googleusercontent.com/a/ACg8ocKvjD4pNEOZJYJ0_zc_0ewnj1D1H-yO-4ol-NP2rQ-4=mo,"hadeh orang dipaksa jd aceng, giliran udah jd aceng, mau disamain jarak anter nya sama yang reguler tp argo tetep goceng, wow ternyata begini kapitalis nya sekarang gojek ya",1,6,1.54.1,2024-01-21 16:08:19,,,1.54.1
cd55a89e-6540-4f30-bfb6-f5c179a09a7f,channel dwiie,https://play-lh.googleusercontent.com/a-/ALV-UjW9VKU4S7ClIKlhDr3Jdxtibq1ELH_oR8AWnwCmIITCuMg,fitur tambah rekening tidak ada jadi gk bisa Wd,5,0,1.54.1,2024-01-21 11:31:27,,,1.54.1
fb28421d-4ea1-440f-8e13-5a608c13af17,Ogi,https://play-lh.googleusercontent.com/a-/ALV-UjV6IL8LgqBKq6oi7LvGnjwufX33bBqxsbUTsWBP91F5BDs,"Kecewa lah update an terbaru aplikasi ini, malah tombol tarik ke gopay ya dihilangin, gimana coba mau tarik duitnya, padahal saya sudah tidak pakai no rekening BCA... sucks lah",3,38,1.21.3,2024-01-21 07:22:25,,,1.21.3
1de33f61-7a67-427b-9f90-bf1609151e90,Zainal Mustofa,https://play-lh.googleusercontent.com/a-/ALV-UjVHeOjL8niLRVd_jFr2rrZ6VRAEk8SwAumsrfb2jUfa-w,"Saldo minus dikasih tunai makin minus, saldo plus dikasih non tunai terus. Tolong perbaiki",1,3,1.54.1,2024-01-20 20:53:12,,,1.54.1
f823773c-ebb8-44a0-8658-6d25d4bb2724,Zero Hundred,https://play-lh.googleusercontent.com/a/ACg8ocLiwbVkz0b6vm2IZRAiYDG8vbd8uTMiXLMqrsOv0lmO=mo,Recent update so bad policy,1,3,1.54.1,2024-01-20 18:10:15,,,1.54.1
822e4d8a-2560-4058-8127-2dc273dc067b,Eric See,https://play-lh.googleusercontent.com/a/ACg8ocL5cfQrOWUYU0zerqS1FOLjZjg87MDNrlj1FBZpsvWZ=mo,Okay good!,4,0,1.54.1,2024-01-20 14:35:24,,,1.54.1
55bdb719-9070-45fb-9e50-ea1367a83790,Sienny Cien,https://play-lh.googleusercontent.com/a-/ALV-UjX3w333MfXXgUIKAmZGjrFkQGB5R2KwvCZ0bm4HLhElbdw,Abis dj update malah force close mulu,1,1,,2024-01-20 12:12:00,,,
70330117-6be9-4d4a-a36a-02dfd5d49768,Mike SKC Seah,https://play-lh.googleusercontent.com/a/ACg8ocKSfPmo3-uAQ4Lu6qha1mYg6_wbTztDxK3IPC-IzBLE=mo,Work fr the master dat pay u best without commision,2,0,,2024-01-20 06:47:05,,,
8ecd1d73-c38c-4b59-b3e4-b621167967bb,Muhammad Arifin,https://play-lh.googleusercontent.com/a-/ALV-UjV4vMaKE656He1roNRtMC5ysZ7dMkCuBnh__nvDssPvPcE,Skrg udah banyak perubahan,5,0,,2024-01-19 21:59:41,,,
bfdf51ff-e104-41c8-aae1-03b9f231bace,Ecommerce Lv8,https://play-lh.googleusercontent.com/a/ACg8ocLKSszkLZH4Ce9pQf2x-pSyjfvPtn9bdynQJLLTmafW=mo,Good,5,0,1.53.5,2024-01-19 19:21:57,,,1.53.5
68428243-2ab4-4e82-be27-2ad0f8d8a420,Syarif Attholibi,https://play-lh.googleusercontent.com/a-/ALV-UjW3MGWG6SPwoUfZI-OXKGU1zRtIPM90DKlU0zx5m42Tm8U,"Small text ... Orang tua gak bisa liat, baiknya ada setting ukuran fonts",1,1,,2024-01-19 18:23:08,,,
bb079076-22cf-4ad7-8fc5-508ecf8b4101,Doni Wahyujati,https://play-lh.googleusercontent.com/a/ACg8ocJU_8X8H0ZV12wOgmMQFSUM82JU4HKAgUPgjT2kA-Fg=mo,Helpful,5,0,1.53.5,2024-01-19 16:14:27,,,1.53.5
69a98c12-e54a-41ed-b4c6-0af4f11c5582,It's Me Fachri,https://play-lh.googleusercontent.com/a-/ALV-UjWFXDnRuW6jsnw1UalZaiDxc2OXRcvaf7NLGQUG4dzJTA,"semenjak pake go patner orderan jd gak beres, bagi hasil terlalu besar, macet gak peningkatan, kita mitra apa babu",1,2,1.54.1,2024-01-19 11:19:04,,,1.54.1
3d3edff0-d7af-46f6-b1f1-d3d3842bf2f2,à¤¹à¤®à¥‡à¤‚ à¤®à¤¾à¤¯ à¤¯à¥‚ Dening,https://play-lh.googleusercontent.com/a-/ALV-UjUabRnlJEjBdmwmk6qseE1CyPL6Al9Kd-gFm-jQNS91o_3j,"Update 1.54.1 di sesi pendapatan, tidak ada opsi tarik ke gopay (hilang)",1,2,1.54.1,2024-01-18 17:50:21,,,1.54.1
8b0b2266-8f0a-4c84-997e-5cd69c73a087,wogie budiman,https://play-lh.googleusercontent.com/a-/ALV-UjUnMON9rwouUJ0W7B37Bzq6DtLZ0u0jOsMdeUReRn8hCg,terima kasih gojek,5,0,1.54.0,2024-01-18 14:43:12,,,1.54.0
cb558f53-772c-4342-bb5a-d620b2997184,Sugiharto,https://play-lh.googleusercontent.com/a/ACg8ocILr3A9n-NsWfZMuIv2lf5ZQXir2165iw1cdRwpnu_M=mo,"Slow response customer service. It takes a lot of time to solve a problem, even though we have follow the rules. If we earn no result with the chat support, we have to spend more money to call the customer service by phone in this internet era. We can solve some problems by ourself with the risk of being suspended by GOJEK'S DARK SYSTEM. I think GOJEK'S MOTTO has been changed now, MORE MONEY, MORE RULES, LESS SERVICE, AND BYE - BYE PARTNERS.",1,23,1.54.1,2024-01-18 11:58:06,,,1.54.1
78427190-feb7-4fcc-9ef1-59a182fe0d1f,Tara 70,https://play-lh.googleusercontent.com/a/ACg8ocI-ispqgyeGZPnOu9B6pWMZ691xFj_L-IzJX4eB_srg=mo,Driver ada yg rame sekali dpt ordernya. Ada pula yg sepi ga dikasih sama sekali. Aplikasi lawak.,1,10,1.54.0,2024-01-17 17:50:32,,,1.54.0
71b72d07-0d0e-40ba-a91e-f5c29c4b7ec8,Beni Putra Pratama,https://play-lh.googleusercontent.com/a-/ALV-UjVSObuyyboOuA1rFZ8_mJjVfbMi1iNn3OruCjOoVPl6czw,"Perbaiki map di aplikasi, agar bisa mengikuti arah kendaraan, jangan hanya terkunci ke arah utara itu sangat menyulitkan dan membingungkan driver saat di persimpangan, contohlah map aplikasi taxsee driver, sangat memudahkan driver.",1,1,1.54.0,2024-01-16 07:25:47,,,1.54.0
4a53486d-55ef-498b-9285-eb765ff247e6,Hanif Muslimin,https://play-lh.googleusercontent.com/a/ACg8ocLT9ECXt22fXVLPe5ZgJAgezOgk180WBbqR3VJxKpoTlQ=mo,"Korporat rakus tlol, mitra skemanya di acak2. Mna skrng ada driver goceng. Yg terpuruk driver reguler. Orderan makin sepi. Aceng lu perah kaya sapi perah sampe abis",1,19,1.54.0,2024-01-15 18:41:27,,,1.54.0
e691ea92-f349-457a-a73c-a91c2c704ebc,Novri Wibisono,https://play-lh.googleusercontent.com/a-/ALV-UjUoMjrCopDuIPT__6U4SEDeV7ZBH54f02X9DHyEtRVEL7g,Makin tolol nih aplikasi,1,3,1.54.0,2024-01-15 15:31:50,,,1.54.0
f2635832-c93d-474b-9888-984533f9f67d,Bang Fer,https://play-lh.googleusercontent.com/a/ACg8ocIfVWwy0T74Z_kBs515pQ5puf3ZKywombrjR_Cbl29f=mo,"Sudah 2thn upload pendaftaran, ga ada jawaban, direspon pas stnk mati doang. Suruh upload ulang, sdh 2x pembaharuan pajak, 2x jg upload ulang. Mau jadi mitta aja susah banget. Musti pakai uang ya. Kira2 harus bayar berapa biar diterima??? :(",1,2,1.54.0,2024-01-15 11:19:19,,,1.54.0
a8ac90ec-210f-47b5-b207-e8864587e063,n Kenta,https://play-lh.googleusercontent.com/a-/ALV-UjV6khIflPBN9dhQN5hIBnnoivv2wdoBZF4a5TZGDotHKg,Tiap vermuk gagal terus tidak ada perbaikan sistem dari pusat. Aplikasi sangat tolol,1,1,1.2.2,2024-01-15 09:50:57,,,1.2.2
c700803f-c398-4cb6-93ee-bf8c03112f55,I Nyoman Waisnawa,https://play-lh.googleusercontent.com/a-/ALV-UjUaiqDQxBuyr5ZQEsqMsvHIHTsrl04S9LL5adjdIRj_Zw,"mantap, mohon untuk nominal Tol diperbaharui karena tarif tol dari bandara ke area kampung gabus 79,500 dan area bogor di atas 90.000",5,0,1.54.0,2024-01-15 02:31:26,,,1.54.0
ff6d064a-911e-432f-aae6-2284a0f96d4a,Wangsa,https://play-lh.googleusercontent.com/a/ACg8ocJoT474FMiYOQOm57di20OdwNIcYasJgv6oaPNN8iWc8aU=mo,"Please, add dark mode feature and fix map direction feature. Sometimes its not accurate force driver to took risk and vehicle cannot through, then when night arrive make automatically choose safest way for driving without cut length way of trip and fare.",3,120,1.54.0,2024-01-14 18:48:43,,,1.54.0
7f44c435-a482-4188-9d2e-c2b6a41c32f7,topi K,https://play-lh.googleusercontent.com/a-/ALV-UjXXmmK9bS_szKtcdK_rEODO-xExUWBOQjJuca9cuiMmN2k,"Semoga tarif gosend bisa naik lg sehingga driver gosend bangga menjalankan orderan gosend meski pick up nya jauh dan barangnya berat/gede, dan pastinya mensejahterakan keluarga",5,3,1.54.0,2024-01-12 17:09:22,,,1.54.0
c79ef85e-48e4-4dd5-9fa2-25d7e2f93590,Jeffry,https://play-lh.googleusercontent.com/a-/ALV-UjWsCby4-m_Ha3KSJUbR7IlDzudeWtA61C8KK7mBqXs2kOE,Cih..,1,1,1.54.0,2024-01-12 15:50:38,,,1.54.0
ace94962-f140-4852-9a86-e02ab3aece15,Yanuar Rachmad Faizal,https://play-lh.googleusercontent.com/a-/ALV-UjW8pBhtE7bhP_FZPhsctrTtSiGQR8MzUnu2cKTXLn9Rv3Cq,"Pickup Location almost always too far from driver's position. Please fix this policy, because it can affect customer's satisfaction and experience (they have to wait more). And for Driver, it takes much cost (fuel, time). Customer often ask to hurry, Driver had to go fast, and the risk of accident is much higher.",1,8,1.53.5,2024-01-11 20:36:48,,,1.53.5
7a7653aa-808c-487b-a1c7-ad5688e15f08,FX Andaka,https://play-lh.googleusercontent.com/a-/ALV-UjWi7jbc7zL7EEMwWFgatqwz4DYPpQ5CI3n6TJhExhGZmYs,"Jangan klaim ""Tech Company"" kalo ga bisa betulin aplikasi ðŸ‘ŽðŸ˜ðŸ‘Ž",1,19,1.54.0,2024-01-11 19:07:25,,,1.54.0
9a8a0b7c-d003-445f-847b-7d45c8d3d0b0,blue dawn,https://play-lh.googleusercontent.com/a/ACg8ocLW70zG4x_bZqV7nAu4q3yZHKhaxZ5Soz12h1wWP4x9=mo,"saldo dompet kenapa di ilangin, kebijakan yang salah, saldo gopay saya buat belanja kebutuhan dan nabung, jadi terusik dan bisa minus",1,3,1.54.0,2024-01-11 16:11:36,,,1.54.0
1caa8a28-9887-4c3e-a39d-e20a51d33cdd,Adimas Ario Afrilando,https://play-lh.googleusercontent.com/a/ACg8ocLbuOVGBp1CntStRqvQ9eF3G7kU3UYeT5BStdeKTQGP=mo,Pokoknya yg andil pembagian order kyknya bukan manusia deh.,1,19,1.54.0,2024-01-11 10:13:39,,,1.54.0
e26c66de-0b1a-45c4-92c2-2e8c347f82f9,Zaki Refaeli,https://play-lh.googleusercontent.com/a-/ALV-UjVu1Glv6611KXSIhANetcyAn040yTBaBcQxEto4G7rm8HE,Zonk,1,3,1.54.0,2024-01-10 20:23:20,,,1.54.0
ab0cad4c-7e29-4185-9c22-9f49c773afaa,Bagus Herdiyanto,https://play-lh.googleusercontent.com/a-/ALV-UjXsetoHvbLH8k9ulG1DFhgSjRZgoxCNTNaZC0E9J9AUDKI,Ga bisa kelarin aplikasi,1,3,1.54.0,2024-01-10 19:23:27,,,1.54.0
1dbcc47e-fa89-44e4-b9d3-8c4f084bdcb6,Jukiarta Ch,https://play-lh.googleusercontent.com/a/ACg8ocJ2YGJYh4ATgiV28SuUD-TNp4PB7XBGttggPRzuEhnY=mo,"Manajemen GoTo, aplikasi km ini selalu merugikan driver, komisi yg diambil per trip mencapai 30-35 persen dari tarif yg dibayar customer, trus tidak mendukung driver sama sekali, misalkan cust menginginkan lewat jalur yang tidak macet tapi jarak tempuh menjadi lebih jauh 3-5 km, tarif tidak ada perubahan, tetap sama, driver selalu disalahkan, padahal customer yang memulai percakapan kasar dan marah duluan, tolong evaluasi jika ingin gojek maju ga..",3,1,1.53.5,2024-01-10 17:27:32,,,1.53.5
dc02be16-b672-457f-829b-8662ba1437b2,Gaung Satrio,https://play-lh.googleusercontent.com/a-/ALV-UjWzSIVXjI6l4w_Pf1aQ-3feKpGqwdGhJ_pOO7lHVkiMl_Q,Team it tulul Gk usah pindahin saldo gopartner ke gopay bodoh. Sistem skrg sudah baik. Ngapai. Kau rubah2. Bodo mending pikirkan naikian tarif yg kemurahan drpada sistem gopay2 biji. Satu ktp satu gopay account sedangkan bnyk driver/rider menggunakan no tlp gopartner yg bukan no primary. Bikin repot saja. Repotnya tidak daftat ktp account gopay tidak bisa transfer keluar. Bodo bener bikin aturan overlapping.,1,0,1.53.5,2024-01-09 23:02:01,,,1.53.5
7effd6bc-3176-44fa-b306-bafd0f50025f,Leno Novo,https://play-lh.googleusercontent.com/a/ACg8ocL5hMqtPLSPXAHXe0BemmRDo553WK6TxhVzrSU4u4k_=mo,"Sebagai pengemudi...sy kecewa dengan aplikasi ini,krn masih banyak rute yang tidak bisa dilewati sesuai petunjuk sedangkan rute yg hatus dilalui harus memutar. Dan hal ini sangat berpengaruh terhadap tarif yg diperoleh. Perbaikilah....!",1,3,1.51.0,2024-01-09 18:52:51,,,1.51.0
673836c2-a0f7-4ce9-8648-9db9b4ffefc1,John Doe,https://play-lh.googleusercontent.com/a/ACg8ocJNYsPXhoJ7_hcMjF-0IeXHolWxXBf8Yt25ZHDWeBo0=mo,"Menunggu order sangat terlalu lama, berpindah2 tempat tidak mempengaruhi masuk nya order. Buang waktu, tenaga & bensin.",1,7,,2024-01-09 16:03:56,,,
e8d3913c-5135-4865-a5de-b373dcef1e09,Roy Channel,https://play-lh.googleusercontent.com/a/ACg8ocKU0ldCr5m2P-wciGN6gqb1wLMNQZh2QMzuakanRCqRcQ=mo,Trash app!,1,3,1.53.5,2024-01-09 08:56:40,,,1.53.5
d8bbf405-cc65-46b9-aa8c-41e156665e7b,Muhammad Bintang Aldifa,https://play-lh.googleusercontent.com/a-/ALV-UjW_UnwgkFySzzVRxdvQEw_M3Xx4tJJb9__qEKNAET7e4w,Nomor pelanggan jangan disensor. Nyusahin driver,1,5,1.53.5,2024-01-08 21:21:46,,,1.53.5
77f8b314-9416-4dd7-b0b0-751db8652a02,I Made Resnawa,https://play-lh.googleusercontent.com/a/ACg8ocLAaP7iuP_akMOp1pu_JWCsvvnAHXjaJPdgoOYHgbon=mo,Sangat membantu,5,0,1.53.3,2024-01-08 18:08:40,,,1.53.3
0fb5ecc5-203d-4f02-9121-e815e46e1dc3,AZLAN MOHAMED,https://play-lh.googleusercontent.com/a/ACg8ocJUxMfof7Fv5F5OMPpPChRvChJsedQen_kac84ZaT4P=mo,The apps super slow nowadays. Can gojek side please help driver to boost the apps.,5,1,1.53.5,2024-01-07 02:40:04,,,1.53.5
f5e5a84b-c807-4c4b-9995-331bb3e49f38,Bounce Tales,https://play-lh.googleusercontent.com/a/ACg8ocJ6D2JmBuS56s0P7FsCOiHdBjly26lTlNOjc_GLMw-w=mo,"Super bad fare price for driver. Gocar Hemat is a joke, if they want a cheap price, why don't they order motorcycle service instead of a car? Why need to force the driver to enable this option everyday? Afterall we're your partner, not your employee, right? You're not calculating pick-up fee, car maintenance fee, and so on. Gojek is a real form of modern colonialism, LoL. I hope someone inside Gojek that create this super cheap price to press the driver got their karma, shame on you, haha",1,2,,2024-01-07 00:09:48,,,
130acf37-fca2-42a9-9b3d-9a449e1fee79,Roihan Adiyat,https://play-lh.googleusercontent.com/a-/ALV-UjVY0gyNFSwGeiBTHQKP13pTKufloy3VS-TD4us8yLA6feo,cannot register new account,1,1,1.53.5,2024-01-06 10:21:45,,,1.53.5
8175fc3d-a0a7-4a96-a936-d9e42f622980,Muhammad Idham,https://play-lh.googleusercontent.com/a-/ALV-UjUn4aZVvjE83EIO205-h4DhEC0ABypON7iKIFfkZEl4SA,"Versi baru semakin berat dan memakan banyak RAM. tolong perbaiki, kasihan yang punya ram kecil.",3,9,,2024-01-04 00:20:14,,,
3643f020-7093-4e68-99ba-0c6aa06660b6,Mulyawan Sukarmo Pradipto,https://play-lh.googleusercontent.com/a-/ALV-UjUIaZoOcUekE9bMVkV1fG2i9Ma2OmcSxyFtNQ7JLaEBXvS5,Terlalu banyak errornya,1,2,1.53.5,2024-01-03 18:58:53,,,1.53.5
1a941a98-6b26-447b-a663-e1ced328f21b,Tri Ferdy,https://play-lh.googleusercontent.com/a-/ALV-UjXwj06sPE7v8aze69Xu4vKjZ-dqlwnYEUoVmYWcPgYX0g,So far selalu aman. sampe saat semalem orang pesen mobil saya mau dimasukin > 7 orang ada lah 12 orang lebih. Nahasnya saya sudah klik sudah dengan penumpang. Jadi tidak bisa cancel antara saya dan penumpang. Akhirnya saya sampai nunggu set jam dan penumpang berindikasi kabur dengan naik kendaraan lain. Saya pun minta tanggung jawab penumpang. Dan akhirnya dia bersedia membayar gojek deposit karena pembayaran via cash. Eh saya kena suspend 7 hari. Banding pun di tolak,1,1,1.53.5,2024-01-02 19:52:17,,,1.53.5
b1223785-1638-47c4-9e7c-58e8b717a6e3,ponco ubani,https://play-lh.googleusercontent.com/a-/ALV-UjX8c3PnLN0uFPw_5gH79OQhs0yge1LFRLH0HyrjP4Ts4cA,Akun saya GACOR!!,5,0,,2024-01-01 10:40:36,,,
0b2eff31-4c47-4756-a1a3-6cf73dfd0fe8,rini agustin,https://play-lh.googleusercontent.com/a-/ALV-UjUvqs0NDa_L_woNvyrVOQNY3SfN1xqt3_cnRq5jyF__3t8E,"Aplikasi saya tidak bisa dibuka , mohon bantuan",3,0,1.53.5,2023-12-30 20:15:56,,,1.53.5
6dd52e2e-5edf-4b4f-a63a-e62c5b05d730,satia bagdja,https://play-lh.googleusercontent.com/a-/ALV-UjVpDblHQ0822TiEiCN9hL6DbCg6orcD59NG0VXCHM7y5ZQ,"Kalau boleh usul untuk orderan gokilat/gosend sameday umumnya dan daerah Bandung khususnya, jangan di sebar dulu ke mitra sebelum argo eatimasi pendapatan minimal Rp.50.000 per 7 paket. Kalau dibawah itu terkadang dilapangan titik ambil/antar dikasih rute yg bisa di akses hanya oleh pejalan kaki motor ga masuk karena masuk gang gang tikus.",5,0,1.53.5,2023-12-30 09:32:56,,,1.53.5
